სოციალიზმი	s ɔ t s i ɑ l i z m i
ფსელი	pʰ s ɛ l i
გრილი	ɡ r ɪ l ɪ
კენტავრი	k ʼ ɛ n t ʼ ɑ v r ɪ
სანუგეშო	s ɑ n u ɡ ɛ ʃ ɔ
ჰადესი	h ɑ d ɛ s ɪ
ფლოსტი	pʰ l ɔ s t ʼ ɪ
აზიური	ɑ z ɪ u r ɪ
მტვრიანი	m t ʼ v r ɪ ɑ n ɪ
უთავო	u tʰ ɑ v ɔ
საფრანგეთის	s ɑ pʰ r ɑ n ɡ ɛ tʰ ɪ s
წასაკითხი	t s ʼ ɑ s ɑ k ʼ ɪ tʰ χ ɪ
ექვსკუთხედი	ɛ kʰ v s k ʼ u tʰ χ ɛ d ɪ
ბლანტი	b l ɑ n t ʼ ɪ
მთაგრეხილი	m tʰ ɑ ɡ r ɛ x i l i
ჭილყვავი	t ʃ ʼ ɪ l q ʼ v ɑ v ɪ
მაზერი	m ɑ z ɛ r i
ფათერაკი	pʰ ɑ tʰ ɛ r ɑ k ʼ i
სასოწარკვეთილება	s ɑ s ɔ t s ʼ ɑ r k ʼ v ɛ tʰ ɪ l ɛ b ɑ
ღვთისმშობლით	ʁ v tʰ ɪ s m ʃ ɔ b l ɪ tʰ
ჭოგრი	t ʃ ʼ ɔ ɡ r ɪ
ეთნოლოგი	ɛ tʰ n ɔ l ɔ ɡ ɪ
გაბარდინი	ɡ ɑ b ɑ r d ɪ n ɪ
უხმარი	u χ m ɑ r ɪ
ედმუნდი	ɛ d m u n d ɪ
ცხრაჯერ	t s χ r ɑ d ʒ ɛ r
მუშაობა	m u ʃ ɑ ɔ b ɑ
ყულაბა	q ʼ u l ɑ b ɑ
მეხი	m ɛ x i
ავტონომიური	ɑ v t ʼ ɔ n ɔ m ɪ u r ɪ
აწოწილი	ɑ t s ʼ ɔ t s ʼ ɪ l ɪ
ესთეტიკური	ɛ s tʰ ɛ t ʼ ɪ k ʼ u r ɪ
გაკუება	ɡ ɑ k ʼ u ɛ b ɑ
შულერი	ʃ u l ɛ r ɪ
კოცნა	k ʼ ɔ t s n ɑ
უახლოესი	u ɑ χ l ɔ ɛ s ɪ
ტკაცანით	t ʼ k ʼ ɑ t s ɑ n ɪ tʰ
კარანტინი	k ʼ ɑ r ɑ n t ʼ ɪ n ɪ
შირმა	ʃ ɪ r m ɑ
სიფრიფანა	s ɪ pʰ r ɪ pʰ ɑ n ɑ
იორკი	ɪ ɔ r k ʼ ɪ
აქამდე	ɑ kʰ ɑ m d ɛ
აპრილის	ɑ p ʼ r ɪ l ɪ s
ღვთაებრივი	ʁ v tʰ ɑ ɛ b r ɪ v ɪ
მენიუ	m ɛ n i u
მონოკლი	m ɔ n ɔ k ʼ l ɪ
ზეგანი	z ɛ ɡ ɑ n ɪ
ცეცხლოვანი	t s ɛ t s χ l ɔ v ɑ n ɪ
ჩაინიკი	t ʃ ɑ i n i k ʼ i
ანტრაქტი	ɑ n t ʼ r ɑ kʰ t ʼ ɪ
ეტრატი	ɛ t ʼ r ɑ t ʼ i
დაუსჯელობა	d ɑ u s d ʒ ɛ l ɔ b ɑ
ინჩი	i n t ʃ i
ნაირობი	n ɑ ɪ r ɔ b ɪ
არაფრის	a r a p r ɪ s
ცხოვრება	t s x ɔ v r ɛ b ɑ
მეურნეობრივი	m ɛ u r n ɛ ɔ b r ɪ v ɪ
დრამატურგი	d r ɑ m ɑ t ʼ u r ɡ ɪ
ალექსანდრია	ɑ l ɛ kʰ s ɑ n d r ɪ ɑ
ნაღვერდალი	n ɑ ʁ v ɛ r d ɑ l ɪ
მაგალითი	m ɑ ɡ ɑ l i tʰ i
ამერიკას	ɑ m ɛ r ɪ k ʼ ɑ s
სადმე	s ɑ d m ɛ
არასკრუპულოზურად	ɑ r ɑ s k ʼ r u p ʼ u l ɔ z u r ɑ d
მუსიკის	m u s ɪ k ʼ ɪ s
ფინანსურად	pʰ ɪ n ɑ n s u r ɑ d
კურო	k ʼ u r ɔ
ქართლმა	kʰ ɑ r tʰ l m ɑ
ცბიერი	t s b ɪ ɛ r ɪ
ცინიკოსი	t s ɪ n ɪ k ʼ ɔ s ɪ
ჟინჟღლიანი	ʒ ɪ n ʒ ʁ l ɪ ɑ n ɪ
ოთხმოცდაერთი	ɔ tʰ x m ɔ t s d ɑ ɛ r tʰ i
უკმეხობა	u k ʼ m ɛ χ ɔ b ɑ
მუნდშტუკი	m u n d ʃ t ʼ u k ʼ ɪ
ლაჟვარდოვანი	l ɑ ʒ v ɑ r d ɔ v ɑ n ɪ
შვილობილი	ʃ v ɪ l ɔ b ɪ l ɪ
კინტო	k ʼ ɪ n t ʼ ɔ
იერარქია	i ɛ r ɑ r kʰ i ɑ
ნომინაცია	n ɔ m ɪ n ɑ t s ɪ ɑ
პიდარასტი	p ʼ i d ɑ r ɑ s t ʼ i
კეკლუცობა	k ʼ ɛ k ʼ l u t s ɔ b ɑ
დაუძლევლად	d ɑ u d z l ɛ v l ɑ d
მონტაჟი	m ɔ n t ʼ ɑ ʒ ɪ
ელვარე	ɛ l v ɑ r ɛ
თანამგრძნობი	tʰ ɑ n ɑ m ɡ r d z n ɔ b ɪ
ტორფნარი	t ʼ ɔ r pʰ n ɑ r ɪ
ლიტერატურული	l ɪ t ʼ ɛ r ɑ t ʼ u r u l ɪ
სასაკლაო	s ɑ s ɑ k ʼ l ɑ ɔ
კაკაჩა	k ʼ ɑ k ʼ ɑ t ʃ ɑ
უკუღმა	u k ʼ u ʁ m ɑ
სუვენირი	s u v ɛ n i r i
ხინჯი	x i n d ʒ i
აურზაური	ɑ u r z ɑ u r ɪ
სახელოვანი	s ɑ x ɛ l ɔ v ɑ n i
თეოდოლიტი	tʰ ɛ ɔ d ɔ l ɪ t ʼ ɪ
მხედარი	m χ ɛ d ɑ r ɪ
საცხობი	s ɑ t s χ ɔ b ɪ
პოლკა	p ʼ ɔ l k ʼ ɑ
გინდა	ɡ ɪ n d ɑ
ამღვრეულობა	ɑ m ʁ v r ɛ u l ɔ b ɑ
ადგილობრივად	ɑ d ɡ ɪ l ɔ b r ɪ v ɑ d
ტრანსცენდენტულად	t ʼ r ɑ n s t s ɛ n d ɛ n t ʼ u l ɑ d
შექმნა	ʃ ɛ kʰ m n ɑ
კაბრიოლეტი	k ʼ ɑ b r i ɔ l ɛ t ʼ i
თარგი	tʰ ɑ r ɡ ɪ
ზურაბიშვილი	z u r ɑ b i ʃ v i l i
ხარბად	χ ɑ r b ɑ d
მდედრი	m d ɛ d r i
საჭმელი	s ɑ t ʃ ʼ m ɛ l ɪ
ნამორაძე	n ɑ m ɔ r ɑ d z ɛ
ევგენი	ɛ v ɡ ɛ n i
ცენზორი	t s ɛ n z ɔ r ɪ
აღჭურვილობა	ɑ ɣ t ʃ ʼ u r v i l ɔ b ɑ
რეინკარნაცია	r ɛ ɪ n k ʼ ɑ r n ɑ t s ɪ ɑ
ოცდაექვსი	ɔ t s d ɑ ɛ kʰ v s i
პლასტილინი	p ʼ l ɑ s t ʼ ɪ l ɪ n ɪ
ვერონიკა	v ɛ r ɔ n ɪ k ʼ ɑ
რიქშა	r ɪ kʰ ʃ ɑ
ცელქი	t s ɛ l kʰ ɪ
დამაჯერებლად	d ɑ m ɑ d ʒ ɛ r ɛ b l ɑ d
სუბსტანცია	s u b s t ʼ ɑ n t s ɪ ɑ
ფისო	pʰ ɪ s ɔ
სიბრტყე	s ɪ b r t ʼ q ʼ ɛ
ჯაბა	d ʒ ɑ b ɑ
გიბრალტარი	ɡ ɪ b r ɑ l t ʼ ɑ r ɪ
ჟანდარმი	ʒ ɑ n d ɑ r m ɪ
პროდიუსერი	p ʼ r ɔ d ɪ u s ɛ r ɪ
რეალურად	r ɛ ɑ l u r ɑ d
მანგუსტა	m ɑ n ɡ u s t ʼ ɑ
ცხიმოვანი	t s χ ɪ m ɔ v ɑ n ɪ
პრაკი	p ʼ r ɑ k ʼ i
მალავს	m ɑ l ɑ v s
ფქვილოვანი	pʰ kʰ v ɪ l ɔ v ɑ n ɪ
სიმარჯვე	s ɪ m ɑ r d ʒ v ɛ
კატასტროფა	k ʼ ɑ t ʼ ɑ s t ʼ r ɔ pʰ ɑ
თავისუფლად	tʰ ɑ v ɪ s u pʰ l ɑ d
მეწარმე	m ɛ t s ʼ ɑ r m ɛ
ფარმაკოლოგი	pʰ ɑ r m ɑ k ʼ ɔ l ɔ ɡ ɪ
პლედი	p ʼ l ɛ d ɪ
კვარტალი	k ʼ v ɑ r t ʼ ɑ l ɪ
ტალახიანი	t ʼ ɑ l ɑ x i ɑ n i
კატა	k ʼ ɑ t ʼ ɑ
რაგუ	r ɑ ɡ u
წნევა	t s ʼ n ɛ v ɑ
სიმბოლური	s ɪ m b ɔ l u r ɪ
კოლოსი	k ʼ ɔ l ɔ s ɪ
უწმინდურად	u t s ʼ m ɪ n d u r ɑ d
ველურად	v ɛ l u r ɑ d
სპირალურად	s p ʼ ɪ r ɑ l u r ɑ d
სოპრანო	s ɔ p ʼ r ɑ n ɔ
წარმომავლობა	t s ʼ ɑ r m ɔ m ɑ v l ɔ b ɑ
ბრაზილია	b r ɑ z i l i ɑ
ბუნდოვანი	b u n d ɔ v ɑ n ɪ
თერმოსტატი	tʰ ɛ r m ɔ s t ʼ ɑ t ʼ ɪ
დასავლეთი	d ɑ s ɑ v l ɛ tʰ i
შპალერი	ʃ p ʼ ɑ l ɛ r ɪ
მაღაზია	m ɑ ɣ ɑ z i ɑ
ამერიკელი	ɑ m ɛ r ɪ k ʼ ɛ l ɪ
კოლრაბი	k ʼ ɔ l r ɑ b ɪ
დუჩე	d u t ʃ ɛ
ვაკუუმი	v ɑ k ʼ u u m ɪ
ინფორმაცია	ɪ n pʰ ɔ r m ɑ t s ɪ ɑ
სამოცდაჩვიდმეტი	s ɑ m ɔ t s d ɑ t ʃ v i d m ɛ t ʼ i
იახტა	ɪ ɑ χ t ʼ ɑ
მსგავსად	m s ɡ ɑ v s ɑ d
დედამთილი	d ɛ d ɑ m tʰ ɪ l ɪ
ღატაკი	ʁ ɑ t ʼ ɑ k ʼ ɪ
შხუნა	ʃ χ u n ɑ
აპლიკაცია	ɑ p ʼ l i k ʼ ɑ t s i ɑ
ზომა	z ɔ m ɑ
მეფური	m ɛ pʰ u r ɪ
მეჯლისი	m ɛ d ʒ l ɪ s ɪ
გოგოდ	ɡ ɔ ɡ ɔ d
არასაიმედო	ɑ r ɑ s ɑ ɪ m ɛ d ɔ
მწკრივად	m t s ʼ k ʼ r ɪ v ɑ d
მარლა	m ɑ r l ɑ
რუმბა	r u m b ɑ
სამკურნალო	s ɑ m k ʼ u r n ɑ l ɔ
პრობლემას	p ʼ r ɔ b l ɛ m ɑ s
ზემო	z ɛ m ɔ
რიტორები	r ɪ t ʼ ɔ r ɛ b ɪ
კომპი	k ʼ ɔ m p ʼ ɪ
ხულიგანი	x u l i ɡ ɑ n i
სინანულით	s ɪ n ɑ n u l ɪ tʰ
ჭურვი	t ʃ ʼ u r v i
გაშეშებულად	ɡ ɑ ʃ ɛ ʃ ɛ b u l ɑ d
ჯეინი	d ʒ ɛ ɪ n ɪ
შანტაჟი	ʃ ɑ n t ʼ ɑ ʒ ɪ
რჩეული	r t ʃ ɛ u l i
ელეგანტური	ɛ l ɛ ɡ ɑ n t ʼ u r ɪ
ცური	t s u r i
კუდამოძუებული	k ʼ u d ɑ m ɔ d z u ɛ b u l i
მეთუნე	m ɛ tʰ u n ɛ
ალტრუისტული	ɑ l t ʼ r u ɪ s t ʼ u l ɪ
რაციონალურად	r ɑ t s ɪ ɔ n ɑ l u r ɑ d
სტატიად	s t ʼ ɑ t ʼ ɪ ɑ d
რეაქციონერი	r ɛ ɑ kʰ t s ɪ ɔ n ɛ r ɪ
ევოლუცია	ɛ v ɔ l u t s ɪ ɑ
ქალწული	kʰ ɑ l t s ʼ u l i
აცეტატი	ɑ t s ɛ t ʼ ɑ t ʼ ɪ
ბარკასი	b ɑ r k ʼ ɑ s ɪ
ქორეოგრაფია	kʰ ɔ r ɛ ɔ ɡ r ɑ pʰ ɪ ɑ
მთიულური	m tʰ ɪ u l u r ɪ
საზაფხულო	s ɑ z ɑ pʰ χ u l ɔ
პროპორციული	p ʼ r ɔ p ʼ ɔ r t s i u l i
მახინჯი	m ɑ x i n d ʒ i
ქურდული	kʰ u r d u l ɪ
ბუშტი	b u ʃ t ʼ i
საზრიანი	s ɑ z r ɪ ɑ n ɪ
აპნისი	ɑ p ʼ n i s i
ინფრაწითელი	i n pʰ r ɑ t s ʼ i tʰ ɛ l i
ძრავა	d z r ɑ v ɑ
ტამბური	t ʼ ɑ m b u r ɪ
დეკლამაცია	d ɛ k ʼ l ɑ m ɑ t s ɪ ɑ
ხარჩო	x ɑ r t ʃ ɔ
ახოვანი	ɑ χ ɔ v ɑ n ɪ
სულ	s u l
ფილტრავს	pʰ i l t ʼ r ɑ v s
სილა	s i l ɑ
ბაკი	b ɑ k ʼ ɪ
ფსიქოპათი	pʰ s ɪ kʰ ɔ p ʼ ɑ tʰ ɪ
დიაგუნალურად	d ɪ ɑ ɡ u n ɑ l u r ɑ d
უსირცხვილობა	u s i r t s x v i l ɔ b ɑ
დაიურვებს	d ɑ ɪ u r v ɛ b s
გადახდა	ɡ ɑ d ɑ x d ɑ
მელოდრამატულად	m ɛ l ɔ d r ɑ m ɑ t ʼ u l ɑ d
გრძნობა	ɡ r d z n ɔ b ɑ
ულტიმატუმი	u l t ʼ ɪ m ɑ t ʼ u m ɪ
ნამცეცი	n ɑ m t s ɛ t s ɪ
დამამძიმებლად	d ɑ m ɑ m d z ɪ m ɛ b l ɑ d
ძირძველი	d z ɪ r d z v ɛ l ɪ
ინფექციურად	ɪ n pʰ ɛ kʰ t s ɪ u r ɑ d
სტრონციუმი	s t ʼ r ɔ n t s i u m i
ბზინვარე	b z ɪ n v ɑ r ɛ
ანაბეჭდი	ɑ n ɑ b ɛ t ʃ ʼ d ɪ
პატარა	p ʼ ɑ t ʼ ɑ r ɑ
პირს	p ʼ ɪ r s
ევქარისტია	ɛ v kʰ ɑ r i s t ʼ i ɑ
მომავალში	m ɔ m ɑ v ɑ l ʃ ɪ
მანჩესტერი	m ɑ n t ʃ ɛ s t ʼ ɛ r ɪ
ორგული	ɔ r ɡ u l i
მეხსიერება	m ɛ χ s ɪ ɛ r ɛ b ɑ
პილიგრიმობა	p ʼ ɪ l ɪ ɡ r ɪ m ɔ b ɑ
თეიზმი	tʰ ɛ ɪ z m ɪ
არგო	ɑ r ɡ ɔ
ძალზე	d z ɑ l z ɛ
კანაფი	k ʼ ɑ n ɑ pʰ ɪ
დარიშხანა	d ɑ r ɪ ʃ χ ɑ n ɑ
მედიდურად	m ɛ d ɪ d u r ɑ d
რადიკალური	r ɑ d ɪ k ʼ ɑ l u r ɪ
ყაიმი	q ʼ ɑ i m i
ნეოფიტი	n ɛ ɔ pʰ ɪ t ʼ ɪ
ზამბია	z ɑ m b i ɑ
ქიტუაშვილი	kʰ i t ʼ u ɑ ʃ v i l i
ქორწინება	kʰ ɔ r t s ʼ ɪ n ɛ b ɑ
ლანგარი	l ɑ n ɡ ɑ r ɪ
ჩილედ	t ʃ ɪ l ɛ d
კოსმეტოლოგი	k ʼ ɔ s m ɛ t ʼ ɔ l ɔ ɡ ɪ
ალუმინი	ɑ l u m i n i
ჩაცმა	t ʃ ɑ t s m ɑ
თავშეყუკავებლად	tʰ ɑ v ʃ ɛ q ʼ u k ʼ ɑ v ɛ b l ɑ d
ფონემა	pʰ ɔ n ɛ m ɑ
ბრუნეი	b r u n ɛ i
წვლილი	t s ʼ v l ɪ l ɪ
ათლეტი	ɑ tʰ l ɛ t ʼ ɪ
ტრუბადური	t ʼ r u b ɑ d u r ɪ
ჩქაროსნული	t ʃ kʰ ɑ r ɔ s n u l ɪ
მატერიალისტურად	m ɑ t ʼ ɛ r ɪ ɑ l ɪ s t ʼ u r ɑ d
კანკალი	k ʼ ɑ n k ʼ ɑ l ɪ
ტერორისტი	t ʼ ɛ r ɔ r ɪ s t ʼ ɪ
ტაძრად	t ʼ ɑ d z r ɑ d
მოუქნელობა	m ɔ u kʰ n ɛ l ɔ b ɑ
ტიპის	t ʼ ɪ p ʼ ɪ s
პითონი	p ʼ ɪ tʰ ɔ n ɪ
მარინადი	m ɑ r ɪ n ɑ d ɪ
რეზუსი	r ɛ z u s ɪ
კანონიერება	k ʼ ɑ n ɔ n ɪ ɛ r ɛ b ɑ
რითაც	r ɪ tʰ ɑ t s
ესკორტი	ɛ s k ʼ ɔ r t ʼ ɪ
აკვირვებს	ɑ k ʼ v i r v ɛ b s
ალიგატორი	ɑ l ɪ ɡ ɑ t ʼ ɔ r ɪ
შეუპოვრად	ʃ ɛ u p ʼ ɔ v r ɑ d
აუტანელი	ɑ u t ʼ ɑ n ɛ l ɪ
უბედურები	u b ɛ d u r ɛ b ɪ
შრაპნელი	ʃ r ɑ p ʼ n ɛ l ɪ
იაღლიში	ɪ ɑ ʁ l ɪ ʃ ɪ
ქარიშხლიანი	kʰ ɑ r ɪ ʃ χ l ɪ ɑ n ɪ
შეუვალობა	ʃ ɛ u v ɑ l ɔ b ɑ
ტელეფონი	t ʼ ɛ l ɛ pʰ ɔ n ɪ
სიქიზმი	s i kʰ i z m i
ყოჩაღ	q ʼ ɔ t ʃ ɑ ɣ
მზედ	m z ɛ d
ციტადელი	t s ɪ t ʼ ɑ d ɛ l ɪ
არასექსუალური	ɑ r ɑ s ɛ kʰ s u ɑ l u r ɪ
სასწაული	s ɑ s t s ʼ ɑ u l i
ძალადობა	d z ɑ l ɑ d ɔ b ɑ
უდარდელად	u d ɑ r d ɛ l ɑ d
რიგიანი	r ɪ ɡ ɪ ɑ n ɪ
ირემი	i r ɛ m i
უზადო	u z ɑ d ɔ
ტკაცუნა	t ʼ k ʼ ɑ t s u n ɑ
გრაციოზული	ɡ r ɑ t s ɪ ɔ z u l ɪ
სამეანო	s ɑ m ɛ ɑ n ɔ
ალაჰი	ɑ l ɑ h ɪ
ლოკალიზაცია	l ɔ k ʼ ɑ l ɪ z ɑ t s ɪ ɑ
პროფესიული	p ʼ r ɔ pʰ ɛ s i u l i
ჭოკი	t ʃ ʼ ɔ k ʼ ɪ
მაპატიეთ	m ɑ p ʼ ɑ t ʼ i ɛ tʰ
ნიდერლანდები	n ɪ d ɛ r l ɑ n d ɛ b ɪ
აპათია	ɑ p ʼ ɑ tʰ ɪ ɑ
კუშტი	k ʼ u ʃ t ʼ ɪ
ასლოკინებს	ɑ s l ɔ k ʼ i n ɛ b s
ფრანი	pʰ r ɑ n i
ექსპონენტურად	ɛ kʰ s p ʼ ɔ n ɛ n t ʼ u r ɑ d
უკუქცევა	u k ʼ u kʰ t s ɛ v ɑ
ჟესტიკულაცია	ʒ ɛ s t ʼ ɪ k ʼ u l ɑ t s ɪ ɑ
გალონი	ɡ ɑ l ɔ n ɪ
ოლქი	ɔ l kʰ i
ბიოლოგიურად	b ɪ ɔ l ɔ ɡ ɪ u r ɑ d
უღმერთობა	u ʁ m ɛ r tʰ ɔ b ɑ
ადგილი	ɑ d ɡ i l i
ჩანგალი	t ʃ ɑ n ɡ ɑ l i
ბებრუხანა	b ɛ b r u χ ɑ n ɑ
პუნში	p ʼ u n ʃ ɪ
ყრუ	q ʼ r u
ბარბაროსული	b ɑ r b ɑ r ɔ s u l ɪ
არისტოკრატია	ɑ r ɪ s t ʼ ɔ k ʼ r ɑ t ʼ ɪ ɑ
მშობიარობა	m ʃ ɔ b ɪ ɑ r ɔ b ɑ
მაღლა	m ɑ ɣ l ɑ
ქედის	kʰ ɛ d ɪ s
კვირადღე	k ʼ v ɪ r ɑ d ʁ ɛ
აგვისტო	ɑ ɡ v i s t ʼ ɔ
ლაიკა	l ɑ ɪ k ʼ ɑ
უმრავლესობა	u m r ɑ v l ɛ s ɔ b ɑ
გავა	ɡ ɑ v ɑ
სვაზილენდი	s v ɑ z i l ɛ n d i
დრამა	d r ɑ m ɑ
ლიტერატურამ	l ɪ t ʼ ɛ r ɑ t ʼ u r ɑ m
გუგული	ɡ u ɡ u l i
სექსუალობა	s ɛ kʰ s u ɑ l ɔ b ɑ
ასისტენტი	ɑ s ɪ s t ʼ ɛ n t ʼ ɪ
გიტარა	ɡ ɪ t ʼ ɑ r ɑ
ტუჩნო	t ʼ u t ʃ n ɔ
უღონო	u ɣ ɔ n ɔ
საცოდავი	s ɑ t s ɔ d ɑ v i
ქრისტინე	kʰ r ɪ s t ʼ ɪ n ɛ
გაურკვევლად	ɡ ɑ u r k ʼ v ɛ v l ɑ d
ზომვადი	z ɔ m v ɑ d ɪ
გდება	ɡ d ɛ b ɑ
ესე	ɛ s ɛ
რიგრიგობით	r ɪ ɡ r ɪ ɡ ɔ b ɪ tʰ
დოლარი	d ɔ l ɑ r ɪ
ღრენით	ʁ r ɛ n ɪ tʰ
ავადმყოფობა	ɑ v ɑ d m q ʼ ɔ pʰ ɔ b ɑ
ლეიბორისტი	l ɛ ɪ b ɔ r ɪ s t ʼ ɪ
აუმღვრევლობა	ɑ u m ʁ v r ɛ v l ɔ b ɑ
პრიზმული	p ʼ r ɪ z m u l ɪ
მონრეალი	m ɔ n r ɛ ɑ l ɪ
თვითნებობა	tʰ v ɪ tʰ n ɛ b ɔ b ɑ
ზურგი	z u r ɡ i
კლასიფიკაცია	k ʼ l ɑ s ɪ pʰ ɪ k ʼ ɑ t s ɪ ɑ
მერკური	m ɛ r k ʼ u r ɪ
ბეზმენი	b ɛ z m ɛ n ɪ
ორმოცდაათი	ɔ r m ɔ t s d ɑ ɑ tʰ i
მეცენატი	m ɛ t s ɛ n ɑ t ʼ ɪ
ქაჯი	kʰ ɑ d ʒ i
ყოლა	q ʼ ɔ l ɑ
ფუნიკულიორი	pʰ u n ɪ k ʼ u l ɪ ɔ r ɪ
ლაყუჩი	l ɑ q ʼ u t ʃ ɪ
უხერხემლო	u χ ɛ r χ ɛ m l ɔ
შესამჩნევი	ʃ ɛ s ɑ m t ʃ n ɛ v i
დებილობა	d ɛ b ɪ l ɔ b ɑ
იტალიელი	ɪ t ʼ ɑ l ɪ ɛ l ɪ
რტყმა	r t ʼ q ʼ m ɑ
ექსჰუმაცია	ɛ kʰ s h u m ɑ t s ɪ ɑ
პედანტურობა	p ʼ ɛ d ɑ n t ʼ u r ɔ b ɑ
ივნისს	ɪ v n ɪ s s
ანტიკურობა	ɑ n t ʼ ɪ k ʼ u r ɔ b ɑ
ხო	x ɔ
საწური	s ɑ t s ʼ u r ɪ
ატავიზმი	ɑ t ʼ ɑ v ɪ z m ɪ
ფრანგი	pʰ r ɑ n ɡ i
ნაურუ	n ɑ u r u
მასიურობა	m ɑ s ɪ u r ɔ b ɑ
ალმანახი	ɑ l m ɑ n ɑ x i
პრიალა	p ʼ r ɪ ɑ l ɑ
ფარმაცია	pʰ ɑ r m ɑ t s ɪ ɑ
მოყავისფრო	m ɔ q ʼ ɑ v ɪ s pʰ r ɔ
სერფინგი	s ɛ r pʰ ɪ n ɡ ɪ
ტაფტა	t ʼ ɑ pʰ t ʼ ɑ
ნეზვი	n ɛ z v ɪ
ნეხვი	n ɛ χ v ɪ
ხედვა	χ ɛ d v ɑ
სკოლა	s k ʼ ɔ l ɑ
ვანადიუმი	v ɑ n ɑ d i u m i
მეორე	m ɛ ɔ r ɛ
ეკონომიკად	ɛ k ʼ ɔ n ɔ m ɪ k ʼ ɑ d
ბორცვებიანი	b ɔ r t s v ɛ b ɪ ɑ n ɪ
პოლონური	p ʼ ɔ l ɔ n u r ɪ
ყეენობა	q ʼ ɛ ɛ n ɔ b ɑ
სენსაციური	s ɛ n s ɑ t s ɪ u r ɪ
მჭადი	m t ʃ ʼ ɑ d i
პილასტრი	p ʼ ɪ l ɑ s t ʼ r ɪ
ნატი	n ɑ t ʼ ɪ
სხივურად	s χ ɪ v u r ɑ d
ბანალურად	b ɑ n ɑ l u r ɑ d
შანდალი	ʃ ɑ n d ɑ l ɪ
ბოიკოტი	b ɔ ɪ k ʼ ɔ t ʼ ɪ
დამთრგუნველი	d ɑ m tʰ r ɡ u n v ɛ l ɪ
განსხვავებით	ɡ ɑ n s χ v ɑ v ɛ b ɪ tʰ
ლექსიკოგრაფი	l ɛ kʰ s ɪ k ʼ ɔ ɡ r ɑ pʰ ɪ
შთამომავლობა	ʃ tʰ ɑ m ɔ m ɑ v l ɔ b ɑ
ალტერნატიულად	ɑ l t ʼ ɛ r n ɑ t ʼ ɪ u l ɑ d
ლიტერატურის	l ɪ t ʼ ɛ r ɑ t ʼ u r ɪ s
კალთა	k ʼ ɑ l tʰ ɑ
მეთხილამურე	m ɛ tʰ χ ɪ l ɑ m u r ɛ
ხმალი	x m ɑ l i
ფორმა	pʰ ɔ r m ɑ
სტვენა	s t ʼ v ɛ n ɑ
გამარჯვება	ɡ ɑ m ɑ r d ʒ v ɛ b ɑ
პრაქტიკული	p ʼ r ɑ kʰ t ʼ i k ʼ u l i
პირფერი	p ʼ ɪ r pʰ ɛ r ɪ
გვინეური	ɡ v ɪ n ɛ u r ɪ
უნებლიე	u n ɛ b l ɪ ɛ
ჩიყვი	t ʃ ɪ q ʼ v ɪ
ზატიკი	z ɑ t ʼ ɪ k ʼ ɪ
აქროლადი	ɑ kʰ r ɔ l ɑ d i
ნაბათი	n ɑ b ɑ tʰ ɪ
ზეიმი	z ɛ ɪ m ɪ
პროვოკაცია	p ʼ r ɔ v ɔ k ʼ ɑ t s i ɑ
დვალიშვილი	d v ɑ l i ʃ v i l i
ხათრიძე	x ɑ tʰ r i d z ɛ
ეჯი	ɛ d ʒ i
ანარქისტი	ɑ n ɑ r kʰ ɪ s t ʼ ɪ
სასჯელი	s ɑ s d ʒ ɛ l ɪ
ვაფშე	v ɑ pʰ ʃ ɛ
ემიგრანტი	ɛ m ɪ ɡ r ɑ n t ʼ ɪ
მალე	m ɑ l ɛ
კომპოსტერი	k ʼ ɔ m p ʼ ɔ s t ʼ ɛ r ɪ
ბიფშტექსი	b ɪ pʰ ʃ t ʼ ɛ kʰ s ɪ
დამაჯერებელი	d ɑ m ɑ d ʒ ɛ r ɛ b ɛ l ɪ
ადვილი	ɑ d v ɪ l ɪ
ოღონდ	ɔ ɣ ɔ n d
ფეხმძიმე	pʰ ɛ x m d z i m ɛ
ვერცხლით	v ɛ r t s χ l ɪ tʰ
გაჩეჩილი	ɡ ɑ t ʃ ɛ t ʃ i l i
ხვეწს	χ v ɛ t s ʼ s
ომლეტი	ɔ m l ɛ t ʼ ɪ
ბასილი	b ɑ s ɪ l ɪ
რქა	r kʰ ɑ
ალერსიანი	ɑ l ɛ r s i ɑ n i
შრიფტი	ʃ r ɪ pʰ t ʼ ɪ
ჩაკიდული	t ʃ ɑ k ʼ i d u l i
სუბიექტური	s u b i ɛ kʰ t ʼ u r i
სტატისტიკური	s t ʼ ɑ t ʼ ɪ s t ʼ ɪ k ʼ u r ɪ
იმპორტერი	i m p ʼ ɔ r t ʼ ɛ r i
მაგივრად	m ɑ ɡ ɪ v r ɑ d
საბჭოს	s ɑ b t ʃ ʼ ɔ s
ზენიტური	z ɛ n ɪ t ʼ u r ɪ
ქართული	kʰ ɑ r tʰ u l i
ოჯახური	ɔ d ʒ ɑ χ u r ɪ
ბანკად	b ɑ n k ʼ ɑ d
თქმა	tʰ kʰ m ɑ
სექციებს	s ɛ kʰ t s ɪ ɛ b s
კატარი	k ʼ ɑ t ʼ ɑ r i
ერთობლიობა	ɛ r tʰ ɔ b l ɪ ɔ b ɑ
იოჰანესბურგი	ɪ ɔ h ɑ n ɛ s b u r ɡ ɪ
სულგრძელად	s u l ɡ r d z ɛ l ɑ d
სახრჩობელა	s ɑ χ r t ʃ ɔ b ɛ l ɑ
ქალწულობა	kʰ ɑ l t s ʼ u l ɔ b ɑ
კერამიკა	k ʼ ɛ r ɑ m ɪ k ʼ ɑ
მეოცნებედ	m ɛ ɔ t s n ɛ b ɛ d
სქემატურად	s kʰ ɛ m ɑ t ʼ u r ɑ d
სიფილისი	s ɪ pʰ ɪ l ɪ s ɪ
ხვედრი	χ v ɛ d r ɪ
უტოპია	u t ʼ ɔ p ʼ ɪ ɑ
ლანჩი	l ɑ n t ʃ ɪ
აკვრევინებს	ɑ k ʼ v r ɛ v i n ɛ b s
სიმხდალე	s ɪ m χ d ɑ l ɛ
გულაგი	ɡ u l ɑ ɡ ɪ
ამოიდო	ɑ m ɔ ɪ d ɔ
ფარისევლური	pʰ ɑ r ɪ s ɛ v l u r ɪ
არასაკმარისად	ɑ r ɑ s ɑ k ʼ m ɑ r ɪ s ɑ d
კომპოტი	k ʼ ɔ m p ʼ ɔ t ʼ ɪ
თხევადი	tʰ χ ɛ v ɑ d ɪ
ავიაქარხანა	ɑ v i ɑ kʰ ɑ r x ɑ n ɑ
რას	r ɑ s
აბინძურებს	ɑ b i n d z u r ɛ b s
მახე	m ɑ x ɛ
უმუშევრობა	u m u ʃ ɛ v r ɔ b ɑ
ცენტრალური	t s ɛ n t ʼ r ɑ l u r ɪ
კატაბალახა	k ʼ ɑ t ʼ ɑ b ɑ l ɑ χ ɑ
სერბეთი	s ɛ r b ɛ tʰ i
ნიმუში	n ɪ m u ʃ ɪ
მრუში	m r u ʃ ɪ
მძინარა	m d z ɪ n ɑ r ɑ
უპატიოსნობა	u p ʼ ɑ t ʼ ɪ ɔ s n ɔ b ɑ
სავარცხელი	s ɑ v ɑ r t s χ ɛ l ɪ
ძნელად	d z n ɛ l ɑ d
მეტეორი	m ɛ t ʼ ɛ ɔ r ɪ
ორცხობილა	ɔ r t s χ ɔ b ɪ l ɑ
ქაბაბი	kʰ ɑ b ɑ b i
დიდებული	d ɪ d ɛ b u l ɪ
ექსპრომტი	ɛ kʰ s p ʼ r ɔ m t ʼ ɪ
მუდმივა	m u d m ɪ v ɑ
დარუბანდი	d ɑ r u b ɑ n d i
გილოცავთ	ɡ ɪ l ɔ t s ɑ v
მეტად	m ɛ t ʼ ɑ d
შპს	ʃ p ʼ s
ახდა	ɑ χ d ɑ
პირქუში	p ʼ ɪ r kʰ u ʃ ɪ
ბოლერო	b ɔ l ɛ r ɔ
ძებნა	d z ɛ b n ɑ
ჭარტარი	t ʃ ʼ ɑ r t ʼ ɑ r ɪ
ვერტიკალური	v ɛ r t ʼ i k ʼ ɑ l u r i
მამიდა	m ɑ m i d ɑ
დახშული	d ɑ x ʃ u l i
პანჩური	p ʼ ɑ n t ʃ u r i
აკურატულად	ɑ k ʼ u r ɑ t ʼ u l ɑ d
უუნარო	u u n ɑ r ɔ
ეკონომიურობა	ɛ k ʼ ɔ n ɔ m ɪ u r ɔ b ɑ
ნებისყოფა	n ɛ b ɪ s q ʼ ɔ pʰ ɑ
ადეკვატური	ɑ d ɛ k ʼ v ɑ t ʼ u r ɪ
ბელიზი	b ɛ l i z i
ბნელი	b n ɛ l i
ტაშკენტი	t ʼ ɑ ʃ k ʼ ɛ n t ʼ ɪ
ავტორმა	ɑ v t ʼ ɔ r m ɑ
ჩარლსტონი	t ʃ ɑ r l s t ʼ ɔ n ɪ
ფეხშიშველა	pʰ ɛ χ ʃ ɪ ʃ v ɛ l ɑ
საკონცერტო	s ɑ k ʼ ɔ n t s ɛ r t ʼ ɔ
ყვერული	q ʼ v ɛ r u l ɪ
ენერგიულად	ɛ n ɛ r ɡ ɪ u l ɑ d
ბალახი	b ɑ l ɑ x i
მალა	m ɑ l ɑ
ახლად	ɑ χ l ɑ d
მიიღებს	m ɪ ɪ ʁ ɛ b s
კუბიზმი	k ʼ u b ɪ z m ɪ
მანიპულაცია	m ɑ n ɪ p ʼ u l ɑ t s ɪ ɑ
გამოჩენილი	ɡ ɑ m ɔ t ʃ ɛ n ɪ l ɪ
ნახატი	n ɑ x ɑ t ʼ i
გსურთ	ɡ s u r tʰ
როიალისტი	r ɔ ɪ ɑ l ɪ s t ʼ ɪ
სავარაუდოდ	s ɑ v ɑ r ɑ u d ɔ d
ჰიბრიდი	h ɪ b r ɪ d ɪ
მარკიზა	m ɑ r k ʼ ɪ z ɑ
მესია	m ɛ s ɪ ɑ
სტრეპტოკოკი	s t ʼ r ɛ p ʼ t ʼ ɔ k ʼ ɔ k ʼ ɪ
ახვრობა	ɑ x v r ɔ b ɑ
ლირიკულად	l ɪ r ɪ k ʼ u l ɑ d
ბიზნესმენი	b ɪ z n ɛ s m ɛ n ɪ
ეშმაკი	ɛ ʃ m ɑ k ʼ i
აეროდრომი	ɑ ɛ r ɔ d r ɔ m ɪ
არათანაბრად	ɑ r ɑ tʰ ɑ n ɑ b r ɑ d
მადლიერებით	m ɑ d l ɪ ɛ r ɛ b ɪ tʰ
ოჯახი	ɔ d ʒ ɑ x i
აფორიაქებულად	ɑ pʰ ɔ r ɪ ɑ kʰ ɛ b u l ɑ d
აყირო	ɑ q ʼ ɪ r ɔ
გყავთ	ɡ q ʼ ɑ v tʰ
წარმომქმნელი	t s ʼ ɑ r m ɔ m kʰ m n ɛ l ɪ
ღოჯი	ɣ ɔ d ʒ i
