კორეული	k ʼ ɔ r ɛ u l ɪ
ყავახანა	q ʼ ɑ v ɑ χ ɑ n ɑ
ინდივიდუუმი	ɪ n d ɪ v ɪ d u u m ɪ
ეკლესიის	ɛ k ʼ l ɛ s ɪ ɪ s
ტორფიანი	t ʼ ɔ r pʰ ɪ ɑ n ɪ
ხელადა	χ ɛ l ɑ d ɑ
მოსახლეობით	m ɔ s ɑ χ l ɛ ɔ b ɪ tʰ
ალპური	ɑ l p ʼ u r ɪ
დიდაქტიკურად	d ɪ d ɑ kʰ t ʼ ɪ k ʼ u r ɑ d
დიდძალი	d ɪ d d z ɑ l ɪ
თანაყვავილი	tʰ ɑ n ɑ q ʼ v ɑ v ɪ l ɪ
ინფორმატიული	ɪ n pʰ ɔ r m ɑ t ʼ ɪ u l ɪ
სამართლის	s ɑ m ɑ r tʰ l ɪ s
შემაღლებული	ʃ ɛ m ɑ ɣ l ɛ b u l i
ტვინი	t ʼ v i n i
მოჩვენებითად	m ɔ t ʃ v ɛ n ɛ b ɪ tʰ ɑ d
აპლოდისმენტი	ɑ p ʼ l ɔ d ɪ s m ɛ n t ʼ ɪ
ქარაფშუტა	kʰ ɑ r ɑ pʰ ʃ u t ʼ ɑ
ოკუპაცია	ɔ k ʼ u p ʼ ɑ t s i ɑ
დაღვრემილი	d ɑ ʁ v r ɛ m ɪ l ɪ
თაღლითურად	tʰ ɑ ʁ l ɪ tʰ u r ɑ d
უდიდესი	u d ɪ d ɛ s ɪ
ქართლით	kʰ ɑ r tʰ l ɪ tʰ
არქეოლოგია	ɑ r kʰ ɛ ɔ l ɔ ɡ ɪ ɑ
ამაზე	ɑ m ɑ z ɛ
გვანცა	ɡ v ɑ n t s ɑ
რამე	r ɑ m ɛ
თელა	tʰ ɛ l ɑ
დამსვენებელი	d ɑ m s v ɛ n ɛ b ɛ l ɪ
მზაკვრობა	m z ɑ k ʼ v r ɔ b ɑ
პირობითად	p ʼ ɪ r ɔ b ɪ tʰ ɑ d
ტაბუ	t ʼ ɑ b u
გვერდს	ɡ v ɛ r d s
უთანასწორობა	u tʰ ɑ n ɑ s t s ʼ ɔ r ɔ b ɑ
ცოდვიანობა	t s ɔ d v ɪ ɑ n ɔ b ɑ
ამსგავსებს	ɑ m s ɡ ɑ v s ɛ b s
ფერფლისფერი	pʰ ɛ r pʰ l ɪ s pʰ ɛ r ɪ
იქნებ	ɪ kʰ n ɛ b
ძმარი	d z m ɑ r i
შუაგული	ʃ u ɑ ɡ u l ɪ
მანეთი	m ɑ n ɛ tʰ i
ტავტოლოგიური	t ʼ ɑ v t ʼ ɔ l ɔ ɡ ɪ u r ɪ
გამოყენებადი	ɡ ɑ m ɔ q ʼ ɛ n ɛ b ɑ d ɪ
ნადირობა	n ɑ d ɪ r ɔ b ɑ
კვლიავი	k ʼ v l i ɑ v i
ამტანობა	ɑ m t ʼ ɑ n ɔ b ɑ
ალგებრა	ɑ l ɡ ɛ b r ɑ
სააგენტო	s ɑ ɑ ɡ ɛ n t ʼ ɔ
ყვავილებიანი	q ʼ v ɑ v ɪ l ɛ b ɪ ɑ n ɪ
კატისებრი	k ʼ ɑ t ʼ i s ɛ b r i
უნაბი	u n ɑ b ɪ
არამიმზიდველად	ɑ r ɑ m ɪ m z ɪ d v ɛ l ɑ d
შუღლი	ʃ u ʁ l ɪ
ქვევრი	kʰ v ɛ v r i
აპათიური	ɑ p ʼ ɑ tʰ ɪ u r ɪ
ვაჟკაცურად	v ɑ ʒ k ʼ ɑ t s u r ɑ d
კვიცი	k ʼ v i t s i
ეჭვიანი	ɛ t ʃ ʼ v ɪ ɑ n ɪ
ფერმერი	pʰ ɛ r m ɛ r ɪ
ნასკვი	n ɑ s k ʼ v ɪ
ხელწერა	χ ɛ l t s ʼ ɛ r ɑ
ტაქტიკოსი	t ʼ ɑ kʰ t ʼ ɪ k ʼ ɔ s ɪ
სოციალური	s ɔ t s i ɑ l u r i
ბაირამი	b ɑ ɪ r ɑ m ɪ
ინდივიდი	ɪ d ɪ v ɪ d ɪ
ბაზელი	b ɑ z ɛ l i
ზალცბურგი	z ɑ l t s b u r ɡ ɪ
რითმავს	r i tʰ m ɑ v s
აღმოსავლეთისკენ	ɑ ʁ m ɔ s ɑ v l ɛ tʰ ɪ s k ʼ ɛ n
ბაქიობა	b ɑ kʰ ɪ ɔ b ɑ
დავბრუნდებით	d ɑ v b r u n d ɛ b ɪ tʰ
პენიცილინი	p ʼ ɛ n ɪ t s ɪ l ɪ n ɪ
თვე	tʰ v ɛ
ევასები	ɛ v ɑ s ɛ b i
ბითუმად	b ɪ tʰ u m ɑ d
თავშესაქცევად	tʰ ɑ v ʃ ɛ s ɑ kʰ t s ɛ v ɑ d
ოკეანური	ɔ k ʼ ɛ ɑ n u r ɪ
გაზრდა	ɡ ɑ z r d ɑ
ცომი	t s ɔ m i
ქრისტესისხლა	kʰ r ɪ s t ʼ ɛ s ɪ s χ l ɑ
მათემატიკა	m ɑ tʰ ɛ m ɑ t ʼ ɪ k ʼ ɑ
პრიმადონა	p ʼ r ɪ m ɑ d ɔ n ɑ
ფიზიოთერაპია	pʰ ɪ z ɪ ɔ tʰ ɛ r ɑ p ʼ ɪ ɑ
ხელშეწყობა	χ ɛ l ʃ ɛ t s ʼ q ʼ ɔ b ɑ
მანძილი	m ɑ n d z i l i
მოლეკულა	m ɔ l ɛ k ʼ u l ɑ
სოფლით	s ɔ pʰ l ɪ tʰ
ჰიპნოზური	h ɪ p ʼ n ɔ z u r ɪ
პაპირუსი	p ʼ ɑ p ʼ ɪ r u s ɪ
ჭეშმარიტება	t ʃ ʼ ɛ ʃ m ɑ r i t ʼ ɛ b ɑ
იარენი	i ɑ r ɛ n i
სარეცელზე	s ɑ r ɛ t s ɛ l z ɛ
მზერა	m z ɛ r ɑ
ღარიბულად	ʁ ɑ r ɪ b u l ɑ d
მძივისებრი	m d z ɪ v ɪ s ɛ b r ɪ
სითბო	s i tʰ b ɔ
ეთერი	ɛ tʰ ɛ r ɪ
შემყარავად	ʃ ɛ m q ʼ ɑ r ɑ v ɑ d
გადაწერს	ɡ ɑ d ɑ t s ʼ ɛ r s
პლანერი	p ʼ l ɑ n ɛ r ɪ
პიზა	p ʼ ɪ z ɑ
ვერცხლისფერი	v ɛ r t s x l i s pʰ ɛ r i
ჩირაღდანი	t ʃ ɪ r ɑ ʁ d ɑ n ɪ
დასამახსოვრებლად	d ɑ s ɑ m ɑ χ s ɔ v r ɛ b l ɑ d
იმუნიზაცია	ɪ m u n ɪ z ɑ t s ɪ ɑ
რეციდივიზმი	r ɛ t s ɪ d ɪ v ɪ z m ɪ
ყიდვა	q ʼ i d v ɑ
მონა	m ɔ n ɑ
ხელოვნებამ	χ ɛ l ɔ v n ɛ b ɑ m
მედუზა	m ɛ d u z ɑ
მძივი	m d z ɪ v ɪ
ძირმაგარა	d z ɪ r m ɑ ɡ ɑ r ɑ
დაშორებით	d ɑ ʃ ɔ r ɛ b ɪ tʰ
მოვიდა	m ɔ v i d ɑ
ხარხარი	x ɑ r x ɑ r i
გაზქურა	ɡ ɑ z kʰ u r ɑ
ჯამაათი	d ʒ ɑ m ɑ ɑ tʰ i
კავკასიური	k ʼ ɑ v k ʼ ɑ s i u r i
ასთმა	ɑ s tʰ m ɑ
ლაგამი	l ɑ ɡ ɑ m i
პირისპირ	p ʼ ɪ r ɪ s p ʼ ɪ r
კლეპტომანია	k ʼ l ɛ p ʼ t ʼ ɔ m ɑ n ɪ ɑ
ხავერდი	χ ɑ v ɛ r d ɪ
ბარომეტრული	b ɑ r ɔ m ɛ t ʼ r u l ɪ
მაგალითად	m ɑ ɡ ɑ l ɪ tʰ ɑ d
მგზნებარე	m ɡ z n ɛ b ɑ r ɛ
ანტიკვარი	ɑ n t ʼ ɪ k ʼ v ɑ r ɪ
მესტვირე	m ɛ s t ʼ v ɪ r ɛ
მომჭირნე	m ɔ m t ʃ ʼ ɪ r n ɛ
ქალაქით	kʰ ɑ l ɑ kʰ ɪ tʰ
პორტერი	p ʼ ɔ r t ʼ ɛ r ɪ
ტივტივით	t ʼ ɪ v t ʼ ɪ v ɪ tʰ
ბათუ	b ɑ tʰ u
აუზს	ɑ u z s
გულძმარვა	ɡ u l d z m ɑ r v ɑ
შესაძლო	ʃ ɛ s ɑ d z l ɔ
მათ	m ɑ tʰ
ამრეკლავი	ɑ m r ɛ k ʼ l ɑ v i
რედაქტირება	r ɛ d ɑ kʰ t ʼ ɪ r ɛ b ɑ
ფრედერიკი	pʰ r ɛ d ɛ r ɪ k ʼ ɪ
კლასიციზმი	k ʼ l ɑ s ɪ t s ɪ z m ɪ
ნაყინი	n ɑ q ʼ i n i
მაკომპრომეტირებლად	m ɑ k ʼ ɔ m p ʼ r ɔ m ɛ t ʼ ɪ r ɛ b l ɑ d
მიახლოებით	m ɪ ɑ χ l ɔ ɛ b ɪ tʰ
გულახდილად	ɡ u l ɑ x d i l ɑ d
ცეცხლსატყორცნი	t s ɛ t s x l s ɑ t ʼ q ʼ ɔ r t s n i
სიმამაცე	s ɪ m ɑ m ɑ t s ɛ
ფილოსოფია	pʰ ɪ l ɔ s ɔ pʰ ɪ ɑ
სელი	s ɛ l i
სფერო	s pʰ ɛ r ɔ
არხი	ɑ r χ ɪ
ჰეტეროგენული	h ɛ t ʼ ɛ r ɔ ɡ ɛ n u l i
ფერეიდანი	pʰ ɛ r ɛ i d ɑ n i
ჯაბახანა	d ʒ ɑ b ɑ x ɑ n ɑ
მასპინძელი	m ɑ s p ʼ ɪ n d z ɛ l ɪ
ზათქიანი	z ɑ tʰ kʰ ɪ ɑ n ɪ
პირუტყვობა	p ʼ ɪ r u t ʼ q ʼ v ɔ b ɑ
ბეჟითად	b ɛ ʒ ɪ tʰ ɑ d
პედერასტი	p ʼ ɛ d ɛ r ɑ s t ʼ ɪ
ხერხმა	χ ɛ r χ m ɑ
ჯორჯ	d ʒ ɔ r d ʒ
ომს	ɔ m s
ცხოვრებად	t s χ ɔ v r ɛ b ɑ d
უღრუბლო	u ʁ r u b l ɔ
იდეალიზმი	i d ɛ ɑ l i z m i
ელინი	ɛ l ɪ n ɪ
ლუფა	l u pʰ ɑ
სოჭი	s ɔ t ʃ ʼ i
უმიწო	u m ɪ t s ʼ ɔ
შედარებითი	ʃ ɛ d ɑ r ɛ b ɪ tʰ ɪ
ფრონტალური	pʰ r ɔ n t ʼ ɑ l u r ɪ
კეთილგონივრულად	k ʼ ɛ tʰ ɪ l ɡ ɔ n ɪ v r u l ɑ d
აბაზი	ɑ b ɑ z i
მიამიტობა	m ɪ ɑ m ɪ t ʼ ɔ b ɑ
ახლებურად	ɑ χ l ɛ b u r ɑ d
დაბადება	d ɑ b ɑ d ɛ b ɑ
თანახმა	tʰ ɑ n ɑ x m ɑ
მოგრძო	m ɔ ɡ r d z ɔ
ლამაზმანი	l ɑ m ɑ z m ɑ n ɪ
არაჰიგიენურად	ɑ r ɑ h ɪ ɡ ɪ ɛ n u r ɑ d
ძეგლი	d z ɛ ɡ l i
ენაჭარტალა	ɛ n ɑ t ʃ ʼ ɑ r t ʼ ɑ l ɑ
ჰიპი	h ɪ p ʼ ɪ
ეკონომიური	ɛ k ʼ ɔ n ɔ m ɪ u r ɪ
ეგოცენტრული	ɛ ɡ ɔ t s ɛ n t ʼ r u l ɪ
კენარი	k ʼ ɛ n ɑ r i
უძრავად	u d z r ɑ v ɑ d
ფაქტორი	pʰ ɑ kʰ t ʼ ɔ r ɪ
სიტყვამრავლად	s ɪ t ʼ q ʼ v ɑ m r ɑ v l ɑ d
მორგი	m ɔ r ɡ ɪ
სინგაპური	s i n ɡ ɑ p ʼ u r i
მემფისი	m ɛ m pʰ ɪ s ɪ
იზოლატორი	ɪ z ɔ l ɑ t ʼ ɔ r ɪ
პასკვილი	p ʼ ɑ s k ʼ v ɪ l ɪ
ოთხმოცდაცხრამეტი	ɔ tʰ x m ɔ t s d ɑ t s x r ɑ m ɛ t ʼ i
ვანდალიზმი	v ɑ n d ɑ l ɪ z m ɪ
ავტოსტოპის	ɑ v t ʼ ɔ s t ʼ ɔ p ʼ ɪ s
არაოფიციალური	ɑ r ɑ ɔ pʰ i t s i ɑ l u r i
ტაიტი	t ʼ ɑ ɪ t ʼ ɪ
მიამიტად	m ɪ ɑ m ɪ t ʼ ɑ d
წებოვნება	t s ʼ ɛ b ɔ v n ɛ b ɑ
მიღებული	m ɪ ʁ ɛ b u l ɪ
აწეული	ɑ t s ʼ ɛ u l ɪ
ჭიხვინი	t ʃ ʼ i x v i n i
ზურმუხტი	z u r m u χ t ʼ ɪ
შემოვლითი	ʃ ɛ m ɔ v l ɪ tʰ ɪ
შატალო	ʃ ɑ t ʼ ɑ l ɔ
ცხვირპაჭუა	t s χ v ɪ r p ʼ ɑ t ʃ ʼ u ɑ
ფილტრი	pʰ ɪ l t ʼ r ɪ
მაგისტრალი	m ɑ ɡ i s t ʼ r ɑ l i
კლოუნი	k ʼ l ɔ u n ɪ
გაგიჟებით	ɡ ɑ ɡ ɪ ʒ ɛ b ɪ tʰ
პაწაწინა	p ʼ ɑ t s ʼ ɑ t s ʼ ɪ n ɑ
ორსული	ɔ r s u l i
ყურე	q ʼ u r ɛ
არაბული	ɑ r ɑ b u l i
ბიბილო	b ɪ b ɪ l ɔ
მოციქული	m ɔ t s i kʰ u l i
ბარბარიზმი	b ɑ r b ɑ r i z m i
საგულდაგულო	s ɑ ɡ u l d ɑ ɡ u l ɔ
გინეა	ɡ ɪ n ɛ ɑ
თასმა	tʰ ɑ s m ɑ
პარასკევი	p ʼ ɑ r ɑ s k ʼ ɛ v i
სიმსუქნე	s ɪ m s u kʰ n ɛ
კატეხიზმო	k ʼ ɑ t ʼ ɛ x i z m ɔ
ვჭამ	v t ʃ ʼ ɑ m
ძარღვი	d z ɑ r ɣ v i
პიროვნებას	p ʼ ɪ r ɔ v n ɛ b ɑ s
ელვარედ	ɛ l v ɑ r ɛ d
სადილი	s ɑ d i l i
ზაზანი	z ɑ z ɑ n ɪ
კონტუზია	k ʼ ɔ n t ʼ u z ɪ ɑ
შალიკაშვილი	ʃ ɑ l i k ʼ ɑ ʃ v i l i
ცეცხლი	t s ɛ t s x l i
ემპირიულად	ɛ m p ʼ ɪ r ɪ u l ɑ d
წარუხოცლად	t s ʼ ɑ r u χ ɔ t s l ɑ d
ქორეოგრაფი	kʰ ɔ r ɛ ɔ ɡ r ɑ pʰ ɪ
კონკორდატი	k ʼ ɔ n k ʼ ɔ r d ɑ t ʼ ɪ
ცოცხალმშობი	t s ɔ t s χ ɑ l m ʃ ɔ b ɪ
მდიდარი	m d ɪ d ɑ r ɪ
ანატომიური	ɑ n ɑ t ʼ ɔ m ɪ u r ɪ
ნელი	n ɛ l ɪ
ვაკანსია	v ɑ k ʼ ɑ n s ɪ ɑ
ბობოქარი	b ɔ b ɔ kʰ ɑ r ɪ
პერიოდულად	p ʼ ɛ r ɪ ɔ d u l ɑ d
ძალავს	d z ɑ l ɑ v s
მიკროსკოპულად	m ɪ k ʼ r ɔ s k ʼ ɔ p ʼ u l ɑ d
გნდე	ɡ n d ɛ
კაბა	k ʼ ɑ b ɑ
მდებარეობს	m d ɛ b ɑ r ɛ ɔ b s
მეტეორიტი	m ɛ t ʼ ɛ ɔ r ɪ t ʼ ɪ
შესაბრალისად	ʃ ɛ s ɑ b r ɑ l ɪ s ɑ d
ბიძა	b i d z ɑ
კონცენტრაცია	k ʼ ɔ n t s ɛ n t ʼ r ɑ t s ɪ ɑ
საჭიროება	s ɑ t ʃ ʼ ɪ r ɔ ɛ b ɑ
კომპეტენცია	k ʼ ɔ m p ʼ ɛ t ʼ ɛ n t s ɪ ɑ
ანთრაციტი	ɑ n tʰ r ɑ t s ɪ t ʼ ɪ
პარადოქსი	p ʼ ɑ r ɑ d ɔ kʰ s ɪ
კეკლუცად	k ʼ ɛ k ʼ l u t s ɑ d
ძერა	d z ɛ r ɑ
ბუშტოვანი	b u ʃ t ʼ ɔ v ɑ n ɪ
პრობლემამ	p ʼ r ɔ b l ɛ m ɑ m
ხშირი	χ ʃ ɪ r ɪ
ჰიდრანტი	h ɪ d r ɑ n t ʼ ɪ
ასწავლის	ɑ s t s ʼ ɑ v l i s
დაფიქრებული	d ɑ pʰ ɪ kʰ r ɛ b u l ɪ
საბითუმო	s ɑ b ɪ tʰ u m ɔ
მთები	m tʰ ɛ b i
პროფესიონალი	p ʼ r ɔ pʰ ɛ s i ɔ n ɑ l i
ლიკანი	l ɪ k ʼ ɑ n ɪ
გამოსახულება	ɡ ɑ m ɔ s ɑ χ u l ɛ b ɑ
კავშირმა	k ʼ ɑ v ʃ ɪ r m ɑ
აბა	ɑ b ɑ
მუზა	m u z ɑ
გართულებული	ɡ ɑ r tʰ u l ɛ b u l i
სტარტი	s t ʼ ɑ r t ʼ ɪ
ამწარებს	ɑ m t s ʼ ɑ r ɛ b s
კალამი	k ʼ ɑ l ɑ m ɪ
პარავს	p ʼ ɑ r ɑ v s
მოლაპარაკება	m ɔ l ɑ p ʼ ɑ r ɑ k ʼ ɛ b ɑ
ქორწილი	kʰ ɔ r t s ʼ ɪ l ɪ
ტრიუმვირი	t ʼ r ɪ u m v ɪ r ɪ
ტვინებო	t ʼ v i n ɛ b ɔ
მილიტარისტი	m ɪ l ɪ t ʼ ɑ r ɪ s t ʼ ɪ
ძალიან	d z ɑ l i ɑ n
უხმოდ	u χ m ɔ d
უკან	u k ʼ ɑ n
სოციალიზაცია	s ɔ t s ɪ ɑ l ɪ z ɑ t s ɪ ɑ
დასიზმრება	d ɑ s ɪ z m r ɛ b ɑ
კახეთს	k ʼ ɑ χ ɛ tʰ s
ერთცხენიანი	ɛ r tʰ t s χ ɛ n ɪ ɑ n ɪ
ყვავილი	q ʼ v ɑ v i l i
ჰიპნოზი	h ɪ p ʼ n ɔ z ɪ
პარტნიორობა	p ʼ ɑ r t ʼ n ɪ ɔ r ɔ b ɑ
კილოვატი	k ʼ ɪ l ɔ v ɑ t ʼ ɪ
პრეზიდიუმი	p ʼ r ɛ z ɪ d ɪ u m ɪ
რეალისტი	r ɛ ɑ l ɪ s t ʼ ɪ
შმაგი	ʃ m ɑ ɡ ɪ
რეფლექსი	r ɛ pʰ l ɛ kʰ s i
დამნაშავესავით	d ɑ m n ɑ ʃ ɑ v ɛ s ɑ v ɪ tʰ
ლოცავს	l ɔ t s ɑ v s
რეალობა	r ɛ ɑ l ɔ b ɑ
ნელთბილი	n ɛ l tʰ b ɪ l ɪ
მაქსიმალური	m ɑ kʰ s ɪ m ɑ l u r ɪ
ქალიშვილობა	kʰ ɑ l ɪ ʃ v ɪ l ɔ b ɑ
ბოსტანი	b ɔ s t ʼ ɑ n ɪ
ასტრა	ɑ s t ʼ r ɑ
ორნამენტული	ɔ r n ɑ m ɛ n t ʼ u l ɪ
დროზოფილა	d r ɔ z ɔ pʰ ɪ l ɑ
ღვინოს	ɣ v i n ɔ s
მკვდარი	m k ʼ v d ɑ r i
ბერავს	b ɛ r ɑ v s
ეპიგრამული	ɛ p ʼ ɪ ɡ r ɑ m u l ɪ
საზიზღრად	s ɑ z ɪ z ʁ r ɑ d
სიმპტომი	s ɪ m p ʼ t ʼ ɔ m ɪ
უდროოდ	u d r ɔ ɔ d
ჭირვეულად	t ʃ ʼ ɪ r v ɛ u l ɑ d
სტადიონი	s t ʼ ɑ d ɪ ɔ n ɪ
ანტონიმი	ɑ n t ʼ ɔ n ɪ m ɪ
მიცემითი	m i t s ɛ m i tʰ i
ჩეჩნეთი	t ʃ ɛ t ʃ n ɛ tʰ i
უბედურად	u b ɛ d u r ɑ d
ჟოლოსფერი	ʒ ɔ l ɔ s pʰ ɛ r ɪ
გადახრილი	ɡ ɑ d ɑ χ r ɪ l ɪ
ფარდა	pʰ ɑ r d ɑ
ბეწვიანი	b ɛ t s ʼ v ɪ ɑ n ɪ
ბრალდება	b r ɑ l d ɛ b ɑ
გულდასაწყვეტად	ɡ u l d ɑ s ɑ t s ʼ q ʼ v ɛ t ʼ ɑ d
ძვრა	d z v r ɑ
სხივოსანი	s χ ɪ v ɔ s ɑ n ɪ
ლანოლინი	l ɑ n ɔ l ɪ n ɪ
ლერწამი	l ɛ r t s ʼ ɑ m i
საფასური	s ɑ pʰ ɑ s u r ɪ
მარილი	m ɑ r i l i
საწრუპავი	s ɑ t s ʼ r u p ʼ ɑ v i
არადამაკმაყოფილებლად	ɑ r ɑ d ɑ m ɑ k ʼ m ɑ q ʼ ɔ pʰ ɪ l ɛ b l ɑ d
შეუსრულებელი	ʃ ɛ u s r u l ɛ b ɛ l ɪ
დიალექტიკა	d ɪ ɑ l ɛ kʰ t ʼ ɪ k ʼ ɑ
უშორესი	u ʃ ɔ r ɛ s ɪ
იმერეთმა	ɪ m ɛ r ɛ tʰ m ɑ
ნეოლოგიზმი	n ɛ ɔ l ɔ ɡ ɪ z m ɪ
მთხრობელი	m tʰ χ r ɔ b ɛ l ɪ
ლუდხანა	l u d χ ɑ n ɑ
ტანგო	t ʼ ɑ n ɡ ɔ
ვაცი	v ɑ t s ɪ
წყალმცენარე	t s ʼ q ʼ ɑ l m t s ɛ n ɑ r ɛ
საცრემლე	s ɑ t s r ɛ m l ɛ
გაბედული	ɡ ɑ b ɛ d u l i
ჯაყვა	d ʒ ɑ q ʼ v ɑ
ჟღმურტლი	ʒ ʁ m u r t ʼ l ɪ
ეთიკური	ɛ tʰ ɪ k ʼ u r ɪ
გამო	ɡ ɑ m ɔ
სიტყვიერი	s i t ʼ q ʼ v i ɛ r i
კოჟრი	k ʼ ɔ ʒ r ɪ
მდაბლად	m d ɑ b l ɑ d
ტიპურად	t ʼ i p ʼ u r ɑ d
ნაკლები	n ɑ k ʼ l ɛ b ɪ
აბრაგი	ɑ b r ɑ ɡ ɪ
ოპტიკოსი	ɔ p ʼ t ʼ ɪ k ʼ ɔ s ɪ
სეისმოგრაფი	s ɛ ɪ s m ɔ ɡ r ɑ pʰ ɪ
მთებმა	m tʰ ɛ b m ɑ
ირაკლი	ɪ r ɑ k ʼ l ɪ
უპირობოდ	u p ʼ ɪ r ɔ b ɔ d
ამერიკა	ɑ m ɛ r i k ʼ ɑ
მთავრობით	m tʰ ɑ v r ɔ b ɪ tʰ
კიმპალი	k ʼ i m p ʼ ɑ l i
პატრიოტი	p ʼ ɑ t ʼ r ɪ ɔ t ʼ ɪ
ბრძოლით	b r d z ɔ l ɪ tʰ
მრისხანე	m r ɪ s χ ɑ n ɛ
პროფესიულად	p ʼ r ɔ pʰ ɛ s ɪ u l ɑ d
გნიასი	ɡ n ɪ ɑ s ɪ
პათეტიკურად	p ʼ ɑ tʰ ɛ tʰ ɪ k ʼ u r ɑ d
წვრილი	t s ʼ v r ɪ l ɪ
მინეტი	m ɪ n ɛ t ʼ ɪ
სტატისტიკოსი	s t ʼ ɑ t ʼ ɪ s t ʼ ɪ k ʼ ɔ s ɪ
ამალა	ɑ m ɑ l ɑ
დობა	d ɔ b ɑ
ტვინებმა	t ʼ v i n ɛ b m ɑ
სექტორი	s ɛ kʰ t ʼ ɔ r i
მეთვალყურე	m ɛ tʰ v ɑ l q ʼ u r ɛ
დიაგნოზი	d ɪ ɑ ɡ n ɔ z ɪ
სიღარიბე	s ɪ ʁ ɑ r ɪ b ɛ
ხომალდი	χ ɔ m ɑ l d ɪ
ოქროს	ɔ kʰ r ɔ s
ადამიანად	ɑ d ɑ m ɪ ɑ n ɑ d
თხილამური	tʰ x i l ɑ m u r i
არასაკმარისი	ɑ r ɑ s ɑ k ʼ m ɑ r ɪ s ɪ
კარბიდი	k ʼ ɑ r b ɪ d ɪ
პარფიუმერი	p ʼ ɑ r pʰ ɪ u m ɛ r ɪ
ფლავი	pʰ l ɑ v i
შემპარავად	ʃ ɛ m p ʼ ɑ r ɑ v ɑ d
კამბოჯა	k ʼ ɑ m b ɔ d ʒ ɑ
ფარში	pʰ ɑ r ʃ ɪ
ხაში	x ɑ ʃ i
ადამი	ɑ d ɑ m ɪ
გზასაცდენილი	ɡ z ɑ s ɑ t s d ɛ n ɪ l ɪ
სამხრეთდასავლეთით	s ɑ m χ r ɛ tʰ d ɑ s ɑ v l ɛ tʰ ɪ tʰ
გალაქტიკა	ɡ ɑ l ɑ kʰ t ʼ ɪ k ʼ ɑ
სიმეტრიულად	s i m ɛ t ʼ r i u l ɑ d
კოხტა	k ʼ ɔ χ t ʼ ɑ
ბეჩავი	b ɛ t ʃ ɑ v ɪ
სოციალურად	s ɔ t s ɪ ɑ l u r ɑ d
ლაბადა	l ɑ b ɑ d ɑ
ოსტატური	ɔ s t ʼ ɑ t ʼ u r ɪ
სესილი	s ɛ s ɪ l ɪ
გოგონა	ɡ ɔ ɡ ɔ n ɑ
საეჭვო	s ɑ ɛ t ʃ ʼ v ɔ
პირველადი	p ʼ i r v ɛ l ɑ d i
მეპატრონე	m ɛ p ʼ ɑ t ʼ r ɔ n ɛ
გენეალოგიურად	ɡ ɛ n ɛ ɑ l ɔ ɡ ɪ u r ɑ d
ზე	z ɛ
ყმაწვილი	q ʼ m ɑ t s ʼ v i l i
მჟავედ	m ʒ ɑ v ɛ d
ქეთევანი	kʰ ɛ tʰ ɛ v ɑ n i
წვრილფეხა	t s ʼ v r ɪ l pʰ ɛ χ ɑ
ჩეხი	t ʃ ɛ χ ɪ
აგენტო	ɑ ɡ ɛ n t ʼ ɔ
სავალუტო	s ɑ v ɑ l u t ʼ ɔ
გააკუებს	ɡ ɑ ɑ k ʼ u ɛ b s
ქვეყნად	kʰ v ɛ q ʼ ɑ n ɑ d
მტრულად	m t ʼ r u l ɑ d
კარტელი	k ʼ ɑ r t ʼ ɛ l ɪ
ტექტონა	t ʼ ɛ kʰ t ʼ ɔ n ɑ
მეზღაპრე	m ɛ z ɣ ɑ p ʼ r ɛ
ბატი	b ɑ t ʼ i
ნახირი	n ɑ x i r i
გაუგებრად	ɡ ɑ u ɡ ɛ b r ɑ d
მგლური	m ɡ l u r i
კაქტუსი	k ʼ ɑ kʰ t ʼ u s i
რამოდენი	r ɑ m ɔ d ɛ n ɪ
გამალებული	ɡ ɑ m ɑ l ɛ b u l ɪ
რიტუალური	r ɪ t ʼ u ɑ l u r ɪ
თამარი	tʰ ɑ m ɑ r ɪ
მავნეობა	m ɑ v n ɛ ɔ b ɑ
ინტელექტი	ɪ n t ʼ ɛ l ɛ kʰ t ʼ ɪ
მემაუდე	m ɛ m ɑ u d ɛ
წოლა	t s ʼ ɔ l ɑ
აკუსტიკა	ɑ k ʼ u s t ʼ ɪ k ʼ ɑ
იგავური	ɪ ɡ ɑ v u r ɪ
ბამი	b ɑ m ɪ
ემანსიპაცია	ɛ m ɑ n s ɪ p ʼ ɑ t s ɪ ɑ
ბედნიერად	b ɛ d n ɪ ɛ r ɑ d
ზიდვა	z i d v ɑ
უხვად	u χ v ɑ d
პაპუნაშვილი	p ʼ ɑ p ʼ u n ɑ ʃ v i l i
ახლოს	ɑ χ l ɔ s
შანსი	ʃ ɑ n s i
ლუიზა	l u ɪ z ɑ
ასაკოვანი	ɑ s ɑ k ʼ ɔ v ɑ n ɪ
დაუძლურებული	d ɑ u d z l u r ɛ b u l ɪ
ანონსი	ɑ n ɔ n s ɪ
გუთები	ɡ u tʰ ɛ b ɪ
ბუნდოვანება	b u n d ɔ v ɑ n ɛ b ɑ
სახელწოდებას	s ɑ χ ɛ l t s ʼ ɔ d ɛ b ɑ s
ისარი	i s ɑ r i
სანატორიუმი	s ɑ n ɑ t ʼ ɔ r ɪ u m ɪ
საბრალოდ	s ɑ b r ɑ l ɔ d
დაბალი	d ɑ b ɑ l i
პანტა	p ʼ ɑ n t ʼ ɑ
თონე	tʰ ɔ n ɛ
ცვლადი	t s v l ɑ d i
ქალწულური	kʰ ɑ l t s ʼ u l u r ɪ
შეუსწავლელი	ʃ ɛ u s t s ʼ ɑ v l ɛ l ɪ
ხდება	x d ɛ b ɑ
სამოვარი	s ɑ m ɔ v ɑ r ɪ
ბრძოლის	b r d z ɔ l ɪ s
მომჟავო	m ɔ m ʒ ɑ v ɔ
ფოტო	pʰ ɔ t ʼ ɔ
მლიქვნელობა	m l i kʰ v n ɛ l ɔ b ɑ
დელგმა	d ɛ l ɡ m ɑ
მარხილი	m ɑ r χ ɪ l ɪ
შინაბერა	ʃ ɪ n ɑ b ɛ r ɑ
სენატორი	s ɛ n ɑ t ʼ ɔ r ɪ
კაკაბი	k ʼ ɑ k ʼ ɑ b i
სხვისი	s x v i s i
სისწორე	s i s t s ʼ ɔ r ɛ
მიშა	m i ʃ ɑ
დათვი	d ɑ tʰ v i
ეჭვი	ɛ t ʃ ʼ v i
ჩაკირული	t ʃ ɑ k ʼ ɪ r u l ɪ
მიწურული	m ɪ t s ʼ u r u l ɪ
წლიანი	t s ʼ l ɪ ɑ n ɪ
რადიუსი	r ɑ d ɪ u s ɪ
ზვერავს	z v ɛ r ɑ v s
ახველებს	ɑ χ v ɛ l ɛ b s
ნაწიბური	n ɑ t s ʼ ɪ b u r ɪ
შამპუნი	ʃ ɑ m p ʼ u n i
უსწორმასწოროდ	u s t s ʼ ɔ r m ɑ s t s ʼ ɔ r ɔ d
მხარდაჭერა	m χ ɑ r d ɑ t ʃ ʼ ɛ r ɑ
ზღვისიქითური	z ʁ v ɪ s ɪ kʰ ɪ tʰ u r ɪ
სანამ	s ɑ n ɑ m
როგორღაც	r ɔ ɡ ɔ r ʁ ɑ t s
სრულყოფილად	s r u l q ʼ ɔ pʰ ɪ l ɑ d
სიმეტრია	s ɪ m ɛ t ʼ r ɪ ɑ
მფლობელობა	m pʰ l ɔ b ɛ l ɔ b ɑ
მძვინვარედ	m d z v ɪ n v ɑ r ɛ d
შესამჩნევად	ʃ ɛ s ɑ m t ʃ n ɛ v ɑ d
საზოგადოებად	s ɑ z ɔ ɡ ɑ d ɔ ɛ b ɑ d
გობელენი	ɡ ɔ b ɛ l ɛ n ɪ
დუეტი	d u ɛ t ʼ ɪ
შემაცბუნებლად	ʃ ɛ m ɑ t s b u n ɛ b l ɑ d
ცვალებადად	t s v ɑ l ɛ b ɑ d ɑ d
ვიკიპედიით	v ɪ k ʼ ɪ p ʼ ɛ d ɪ ɪ tʰ
ვაჟკაცობა	v ɑ ʒ k ʼ ɑ t s ɔ b ɑ
უფართოესი	u pʰ ɑ r tʰ ɔ ɛ s ɪ
გზაზე	ɡ z ɑ z ɛ
იაპონიით	ɪ ɑ p ʼ ɔ n ɪ ɪ tʰ
გამომძალველურად	ɡ ɑ m ɔ m d z ɑ l v ɛ l u r ɑ d
სასტიკად	s ɑ s t ʼ ɪ k ʼ ɑ d
სწორკუთხა	s t s ʼ ɔ r k ʼ u tʰ χ ɑ
ნაყალბევი	n ɑ q ʼ ɑ l b ɛ v ɪ
რუდუნებს	r u d u n ɛ b s
გაზრდილიყო	ɡ ɑ z r d ɪ l ɪ q ʼ ɔ
ქვენიადაგი	kʰ v ɛ n ɪ ɑ d ɑ ɡ ɪ
აბიბინებს	ɑ b i b i n ɛ b s
კირი	k ʼ ɪ r ɪ
რეჰანს	r ɛ h ɑ n s
მეურვე	m ɛ u r v ɛ
კომპეტენტური	k ʼ ɔ m p ʼ ɛ t ʼ ɛ n t ʼ u r ɪ
ბიოლოგია	b ɪ ɔ l ɔ ɡ ɪ ɑ
ჩინეთმა	t ʃ ɪ n ɛ tʰ m ɑ
აისბერგი	ɑ ɪ s b ɛ r ɡ ɪ
კაკაო	k ʼ ɑ k ʼ ɑ ɔ
ალვეოლური	ɑ l v ɛ ɔ l u r ɪ
დანია	d ɑ n i ɑ
მონოთეიზმი	m ɔ n ɔ tʰ ɛ ɪ z m ɪ
დოკი	d ɔ k ʼ ɪ
დაჭიმული	d ɑ t ʃ ʼ ɪ m u l ɪ
პირმრგვალი	p ʼ ɪ r m r ɡ v ɑ l ɪ
ფარმაცევტული	pʰ ɑ r m ɑ t s ɛ v t ʼ u l ɪ
გომი	ɡ ɔ m i
ჯანი	d ʒ ɑ n ɪ
ღერო	ɣ ɛ r ɔ
ბავშვები	b ɑ v ʃ v ɛ b i
ურყევად	u r q ʼ ɛ v ɑ d
უნამუსობა	u n ɑ m u s ɔ b ɑ
ფრიალოდ	pʰ r ɪ ɑ l ɔ d
საფრანგეთით	s ɑ pʰ r ɑ n ɡ ɛ tʰ ɪ tʰ
პოლისპასტი	p ʼ ɔ l ɪ s p ʼ ɑ s t ʼ ɪ
უჭკუო	u t ʃ ʼ k ʼ u ɔ
სპილო	s p ʼ i l ɔ
ჯიშიანი	d ʒ ɪ ʃ ɪ ɑ n ɪ
უქუდო	u kʰ u d ɔ
უნიკალური	u n ɪ k ʼ ɑ l u r ɪ
სიმბოლო	s i m b ɔ l ɔ
უშიშრობა	u ʃ i ʃ r ɔ b ɑ
ვოლტი	v ɔ l t ʼ ɪ
ლიფტი	l ɪ pʰ t ʼ ɪ
სავრცობი	s ɑ v r t s ɔ b i
ჩალიჩობა	t ʃ ɑ l ɪ t ʃ ɔ b ɑ
