სმენადობა	s m ɛ n ɑ d ɔ b ɑ
ცნობილი	t s n ɔ b ɪ l ɪ
პაემანნი	p ʼ ɑ ɛ m ɑ n n i
გაატარებს	ɡ ɑ ɑ t ʼ ɑ r ɛ b s
ფუძე	pʰ u d z ɛ
ჯავშნიანი	d ʒ ɑ v ʃ n ɪ ɑ n ɪ
უგრძნობად	u ɡ r d z n ɔ b ɑ d
ანთოლოგია	ɑ n tʰ ɔ l ɔ ɡ ɪ ɑ
კავალკადა	k ʼ ɑ v ɑ l k ʼ ɑ d ɑ
ფიბულა	pʰ ɪ b u l ɑ
არგუსი	ɑ r ɡ u s ɪ
არამყარი	ɑ r ɑ m q ʼ ɑ r ɪ
კოპწია	k ʼ ɔ p ʼ t s ʼ ɪ ɑ
ბიძგი	b i d z ɡ i
პიანინო	p ʼ i ɑ n i n ɔ
გულუხვობა	ɡ u l u χ v ɔ b ɑ
სიმდიდრე	s ɪ m d ɪ d r ɛ
დეკრეტი	d ɛ k ʼ r ɛ t ʼ ɪ
კლერიკალური	k ʼ l ɛ r ɪ k ʼ ɑ l u r ɪ
გამოსვლას	ɡ ɑ m ɔ s v l ɑ s
იდუმალად	ɪ d u m ɑ l ɑ d
ინერცია	ɪ n ɛ r t s ɪ ɑ
პინგვინი	p ʼ ɪ n ɡ v ɪ n ɪ
ამხედრებული	ɑ m χ ɛ d r ɛ b u l ɪ
მზრუნველად	m z r u n v ɛ l ɑ d
მაკედონია	m ɑ k ʼ ɛ d ɔ n i ɑ
სკულპტურული	s k ʼ u l p ʼ t ʼ u r u l ɪ
რესკრიპტი	r ɛ s k ʼ r ɪ p ʼ t ʼ ɪ
ვიკიპედია	v i k ʼ i p ʼ ɛ d i ɑ
კოლხეთი	k ʼ ɔ l x ɛ tʰ i
ხმამაღლამოლაპარაკე	x m ɑ m ɑ ɣ l ɑ m ɔ l ɑ p ʼ ɑ r ɑ k ʼ ɛ
წონა	t s ʼ ɔ n ɑ
ანარქიზმი	ɑ n ɑ r kʰ ɪ z m ɪ
ბედობა	b ɛ d ɔ b ɑ
მანიაკალურად	m ɑ n i ɑ k ʼ ɑ l u r ɑ d
სინუსი	s i n u s i
პატიოსნად	p ʼ ɑ t ʼ ɪ ɔ s n ɑ d
ეპოლეტი	ɛ p ʼ ɔ l ɛ t ʼ ɪ
წყნარად	t s ʼ q ʼ n ɑ r ɑ d
მშვიდობა	m ʃ v i d ɔ b ɑ
ჩითი	t ʃ i tʰ i
სენსაციურად	s ɛ n s ɑ t s ɪ u r ɑ d
უბანი	u b ɑ n i
ექიმად	ɛ kʰ ɪ m ɑ d
ტეხს	t ʼ ɛ χ s
არაბიძე	ɑ r ɑ b i d z ɛ
ჭიანჭველად	t ʃ ʼ ɪ ɑ n t ʃ ʼ v ɛ l ɑ d
მოიჯარე	m ɔ ɪ d ʒ ɑ r ɛ
პრეტენზიული	p ʼ r ɛ t ʼ ɛ n z ɪ u l ɪ
დარბაზობა	d ɑ r b ɑ z ɔ b ɑ
იაპონია	i ɑ p ʼ ɔ n i ɑ
ურჩხული	u r t ʃ χ u l ɪ
გაგიჟებული	ɡ ɑ ɡ ɪ ʒ ɛ b u l ɪ
მორჩილობა	m ɔ r t ʃ ɪ l ɔ b ɑ
პრემიამ	p ʼ r ɛ m ɪ ɑ m
წამოსროლა	t s ʼ ɑ m ɔ s r ɔ l ɑ
არასრულად	ɑ r ɑ s r u l ɑ d
საკანი	s ɑ k ʼ ɑ n ɪ
უცოდველობა	u t s ɔ d v ɛ l ɔ b ɑ
თევზი	tʰ ɛ v z i
ზიგზაგურად	z ɪ ɡ z ɑ ɡ u r ɑ d
ტყნავს	t ʼ q ʼ n ɑ v s
არაჩვეულებრივი	ɑ r ɑ t ʃ v ɛ u l ɛ b r ɪ v ɪ
ატომი	ɑ t ʼ ɔ m ɪ
მქონდა	m kʰ ɔ n d ɑ
ქუდი	kʰ u d i
კახეთად	k ʼ ɑ χ ɛ tʰ ɑ d
ნამდვილობა	n ɑ m d v ɪ l ɔ b ɑ
ტაქტიკურად	t ʼ ɑ kʰ t ʼ ɪ k ʼ u r ɑ d
თეორიულად	tʰ ɛ ɔ r ɪ u l ɑ d
მუნიციპალურად	m u n ɪ t s ɪ p ʼ ɑ l u r ɑ d
თავხე	tʰ ɑ v χ ɛ
ჭინჭილა	t ʃ ʼ ɪ n t ʃ ʼ ɪ l ɑ
კუჭი	k ʼ u t ʃ ʼ i
მენთოლი	m ɛ n tʰ ɔ l ɪ
თურქეთით	tʰ u r kʰ ɛ tʰ ɪ tʰ
არეულობა	ɑ r ɛ u l ɔ b ɑ
პატრიოტული	p ʼ ɑ t ʼ r ɪ ɔ t ʼ u l ɪ
აივანი	ɑ ɪ v ɑ n ɪ
დასასრული	d ɑ s ɑ s r u l ɪ
სააბატო	s ɑ ɑ b ɑ t ʼ ɔ
აკვიატება	ɑ k ʼ v i ɑ t ʼ ɛ b ɑ
ავაზა	ɑ v ɑ z ɑ
წარმართები	t s ʼ ɑ r m ɑ r tʰ ɛ b ɪ
მეთხუთმეტე	m ɛ tʰ x u tʰ m ɛ t ʼ ɛ
დაძაბულობა	d ɑ d z ɑ b u l ɔ b ɑ
ყაბაყი	q ʼ ɑ b ɑ q ʼ i
ანომალიური	ɑ n ɔ m ɑ l ɪ u r ɪ
მამობრივად	m ɑ m ɔ b r ɪ v ɑ d
დები	d ɛ b i
წინდაუხედავი	t s ʼ ɪ n d ɑ u χ ɛ d ɑ v ɪ
ფავორიტი	pʰ ɑ v ɔ r ɪ t ʼ ɪ
პოლიგონი	p ʼ ɔ l ɪ ɡ ɔ n ɪ
ანეკდოტური	ɑ n ɛ k ʼ d ɔ t ʼ u r ɪ
შეუდრეკლად	ʃ ɛ u d r ɛ k ʼ l ɑ d
აუდიტორია	ɑ u d ɪ t ʼ ɔ r ɪ ɑ
ყითა	q ʼ ɪ tʰ ɑ
სენსუალური	s ɛ n s u ɑ l u r ɪ
კრება	k ʼ r ɛ b ɑ
უხამსი	u χ ɑ m s ɪ
გადახოტრილი	ɡ ɑ d ɑ χ ɔ t ʼ r ɪ l ɪ
თავხედი	tʰ ɑ v χ ɛ d ɪ
მერაბიშვილი	m ɛ r ɑ b i ʃ v i l i
გაუმაძღრად	ɡ ɑ u m ɑ d z ʁ r ɑ d
არმიამ	ɑ r m ɪ ɑ m
კუბო	k ʼ u b ɔ
ერესი	ɛ r ɛ s ɪ
ნუსხა	n u s χ ɑ
აგლომერაცია	ɑ ɡ l ɔ m ɛ r ɑ t s ɪ ɑ
თალმუდი	tʰ ɑ l m u d ɪ
ასორტი	ɑ s ɔ r t ʼ ɪ
დასჯა	d ɑ s d ʒ ɑ
შუამდგომლობა	ʃ u ɑ m d ɡ ɔ m l ɔ b ɑ
ეკონომიკას	ɛ k ʼ ɔ n ɔ m ɪ k ʼ ɑ s
კოიოტი	k ʼ ɔ ɪ ɔ t ʼ ɪ
ბათქაში	b ɑ tʰ kʰ ɑ ʃ ɪ
ტელური	t ʼ ɛ l u r i
მოქლონი	m ɔ kʰ l ɔ n ɪ
მარტით	m ɑ r t ʼ ɪ tʰ
შეშფოთებული	ʃ ɛ ʃ pʰ ɔ tʰ ɛ b u l ɪ
შეგიძლიათ	ʃ ɛ ɡ ɪ d z l ɪ ɑ tʰ
მოქალაქე	m ɔ kʰ ɑ l ɑ kʰ ɛ
კომპიუტერულად	k ʼ ɔ m p ʼ ɪ u t ʼ ɛ r u l ɑ d
ჭილობი	t ʃ ʼ ɪ l ɔ b ɪ
ცეცხლფარეში	t s ɛ t s χ l pʰ ɑ r ɛ ʃ ɪ
უკვე	u k ʼ v ɛ
პოინტერი	p ʼ ɔ ɪ n t ʼ ɛ r ɪ
დაჟინებული	d ɑ ʒ ɪ n ɛ b u l ɪ
ლოგიკური	l ɔ ɡ i k ʼ u r i
ღვივილი	ɣ v i v i l i
შეხვედრა	ʃ ɛ x v ɛ d r ɑ
ინდუსი	ɪ n d u s ɪ
ბრიკეტი	b r ɪ k ʼ ɛ t ʼ ɪ
დუმილი	d u m i l i
მადმუაზელი	m ɑ d m u ɑ z ɛ l ɪ
აზრი	ɑ z r i
შარშანდელი	ʃ ɑ r ʃ ɑ n d ɛ l i
უეცარი	u ɛ t s ɑ r ɪ
გეოლოგიურად	ɡ ɛ ɔ l ɔ ɡ ɪ u r ɑ d
ნაღველა	n ɑ ɣ v ɛ l ɑ
ყელსახვევი	q ʼ ɛ l s ɑ χ v ɛ v ɪ
ატრიალებს	ɑ t ʼ r ɪ ɑ l ɛ b s
ანა	ɑ n ɑ
კოლონიალიზმი	k ʼ ɔ l ɔ n ɪ ɑ l ɪ z m ɪ
საწყისი	s ɑ t s ʼ q ʼ ɪ s ɪ
თაღლითობა	tʰ ɑ ʁ l ɪ tʰ ɔ b ɑ
იდეალისტური	ɪ d ɛ ɑ l ɪ s t ʼ u r ɪ
ორიგინალურად	ɔ r ɪ ɡ ɪ n ɑ l u r ɑ d
ეპარქია	ɛ p ʼ ɑ r kʰ ɪ ɑ
გამბია	ɡ ɑ m b i ɑ
სარკასტულად	s ɑ r k ʼ ɑ s t ʼ u l ɑ d
ბუქსირება	b u kʰ s i r ɛ b ɑ
რუსეთმა	r u s ɛ tʰ m ɑ
ყოფნა	q ʼ ɔ pʰ n ɑ
ეროვნული	ɛ r ɔ v n u l ɪ
ჭიმავს	t ʃ ʼ i m ɑ v s
ხელშეკრულება	χ ɛ l ʃ ɛ k ʼ r u l ɛ b ɑ
ქეთრინი	kʰ ɛ tʰ r ɪ n ɪ
იმიტატორი	ɪ m ɪ t ʼ ɑ t ʼ ɔ r ɪ
დაფნა	d ɑ pʰ n ɑ
ზიგზაგი	z ɪ ɡ z ɑ ɡ ɪ
უკურნებლად	u k ʼ u r n ɛ b l ɑ d
ფაქსიმილე	pʰ ɑ kʰ s ɪ m ɪ l ɛ
ბოტულიზმი	b ɔ t ʼ u l ɪ z m ɪ
მეფობა	m ɛ pʰ ɔ b ɑ
ნაღები	n ɑ ʁ ɛ b ɪ
უცდომლად	u t s d ɔ m l ɑ d
ინტერმედია	ɪ n t ʼ ɛ r m ɛ d ɪ ɑ
პოზიორი	p ʼ ɔ z ɪ ɔ r ɪ
ვაზი	v ɑ z i
სპორა	s p ʼ ɔ r ɑ
ჩახარშავს	t ʃ ɑ x ɑ r ʃ ɑ v s
ბაზა	b ɑ z ɑ
საშუალოდ	s ɑ ʃ u ɑ l ɔ d
ქვეცნობიერი	kʰ v ɛ t s n ɔ b ɪ ɛ r ɪ
ჭიკარტი	t ʃ ʼ ɪ k ʼ ɑ r t ʼ ɪ
ბრიჯი	b r ɪ d ʒ ɪ
მოცხარი	m ɔ t s χ ɑ r ɪ
ბრინჯი	b r i n d ʒ i
დაუზღვეველი	d ɑ u z ʁ v ɛ v ɛ l ɪ
შებოჭილი	ʃ ɛ b ɔ t ʃ ʼ ɪ l ɪ
მიქცევა	m i kʰ t s ɛ v ɑ
გადამდგარი	ɡ ɑ d ɑ m d ɡ ɑ r i
ეთიოპიელი	ɛ tʰ ɪ ɔ p ʼ ɪ ɛ l ɪ
მინიატურა	m ɪ n ɪ ɑ t ʼ u r ɑ
ხიზილალა	χ ɪ z ɪ l ɑ l ɑ
უდრტვინველად	u d r t ʼ v ɪ n v ɛ l ɑ d
ჰიენა	h i ɛ n ɑ
ბოცმანი	b ɔ t s m ɑ n ɪ
მონარქი	m ɔ n ɑ r kʰ ɪ
ჩობანი	t ʃ ɔ b ɑ n i
დრეკს	d r ɛ k ʼ s
გვიანი	ɡ v i ɑ n i
მამობილი	m ɑ m ɔ b ɪ l ɪ
გაკეთებული	ɡ ɑ k ʼ ɛ tʰ ɛ b u l i
განაწილება	ɡ ɑ n ɑ t s ʼ i l ɛ b ɑ
უინტერესოდ	u ɪ n t ʼ ɛ r ɛ s ɔ d
სიყვარული	s i q ʼ v ɑ r u l i
პაციფისტი	p ʼ ɑ t s ɪ pʰ ɪ s t ʼ ɪ
ჩეხს	t ʃ ɛ χ s
სამართალმა	s ɑ m ɑ r tʰ ɑ l m ɑ
ხმით	χ m ɪ tʰ
გინეკოლოგია	ɡ ɪ n ɛ k ʼ ɔ l ɔ ɡ ɪ ɑ
პასაჟი	p ʼ ɑ s ɑ ʒ ɪ
თვითნებურად	tʰ v ɪ tʰ n ɛ b u r ɑ d
რწმენა	r t s ʼ m ɛ n ɑ
დალაქი	d ɑ l ɑ kʰ ɪ
აბსოლუტურად	ɑ b s ɔ l u t ʼ u r ɑ d
კალენდარი	k ʼ ɑ l ɛ n d ɑ r i
გულმოდგინება	ɡ u l m ɔ d ɡ ɪ n ɛ b ɑ
დამბაჩა	d ɑ m b ɑ t ʃ ɑ
მითი	m ɪ tʰ ɪ
მეტყველება	m ɛ t ʼ q ʼ v ɛ l ɛ b ɑ
ხრიალი	χ r ɪ ɑ l ɪ
აჩრდილი	ɑ t ʃ r d ɪ l ɪ
გროტესკულად	ɡ r ɔ t ʼ ɛ s k ʼ u l ɑ d
კატასტროფული	k ʼ ɑ t ʼ ɑ s t ʼ r ɔ pʰ u l ɪ
კუთვნილება	k ʼ u tʰ v n ɪ l ɛ b ɑ
მართლმადიდებელი	m ɑ r tʰ l m ɑ d i d ɛ b ɛ l i
ალტი	ɑ l t ʼ ɪ
ტკბილეულობა	t ʼ k ʼ b ɪ l ɛ u l ɔ b ɑ
დიფრაქცია	d ɪ pʰ r ɑ kʰ t s ɪ ɑ
დაცინვით	d ɑ t s ɪ n v ɪ tʰ
ჭუნირი	t ʃ ʼ u n i r i
საზიანო	s ɑ z ɪ ɑ n ɔ
ფართე	pʰ ɑ r tʰ ɛ
მდაბალი	m d ɑ b ɑ l i
ოთხმოცდათექვსმეტი	ɔ tʰ x m ɔ t s d ɑ tʰ ɛ kʰ v s m ɛ t ʼ i
მეფუტკრე	m ɛ pʰ u t ʼ k ʼ r ɛ
მარილწყალი	m ɑ r ɪ l t s ʼ q ʼ ɑ l ɪ
სიფხიზლე	s ɪ pʰ χ ɪ z l ɛ
გეომეტრიულად	ɡ ɛ ɔ m ɛ t ʼ r ɪ u l ɑ d
შეჯვარებული	ʃ ɛ d ʒ v ɑ r ɛ b u l ɪ
სქელი	s kʰ ɛ l ɪ
ვისტი	v ɪ s t ʼ ɪ
რიტმულად	r ɪ t ʼ m u l ɑ d
ნაკრები	n ɑ k ʼ r ɛ b ɪ
არქიტექტურულად	ɑ r kʰ ɪ t ʼ ɛ kʰ t ʼ u r u l ɑ d
ტიპს	t ʼ ɪ p ʼ s
ჭუჭუ	t ʃ ʼ u t ʃ ʼ u
ფერწერა	pʰ ɛ r t s ʼ ɛ r ɑ
ტექნიკური	t ʼ ɛ kʰ n i k ʼ u r i
თავსაბურავი	tʰ ɑ v s ɑ b u r ɑ v ɪ
ეკონომიკის	ɛ k ʼ ɔ n ɔ m ɪ k ʼ ɪ s
გრამატიკოსი	ɡ r ɑ m ɑ t ʼ ɪ k ʼ ɔ s ɪ
პრელატი	p ʼ r ɛ l ɑ t ʼ ɪ
ათჯერადი	ɑ tʰ d ʒ ɛ r ɑ d ɪ
კარნავალი	k ʼ ɑ r n ɑ v ɑ l ɪ
სომბრერო	s ɔ m b r ɛ r ɔ
მოსაჩვენებლად	m ɔ s ɑ t ʃ v ɛ n ɛ b l ɑ d
სამეცნიერო	s ɑ m ɛ t s n ɪ ɛ r ɔ
ღვიძლები	ɣ v i d z l ɛ b i
დაგეროტიპი	d ɑ ɡ ɛ r ɔ t ʼ ɪ p ʼ ɪ
სიაფანდი	s i ɑ pʰ ɑ n d i
დაუზარებლობა	d ɑ u z ɑ r ɛ b l ɔ b ɑ
რუთი	r u tʰ ɪ
გაუწონასწორებლად	ɡ ɑ u t s ʼ ɔ n ɑ s t s ʼ ɔ r ɛ b l ɑ d
სინამდვილე	s ɪ n ɑ m d v ɪ l ɛ
კოშმარული	k ʼ ɔ ʃ m ɑ r u l ɪ
არააკურატულად	ɑ r ɑ ɑ k ʼ u r ɑ t ʼ u l ɑ d
არაერთხელ	ɑ r ɑ ɛ r tʰ χ ɛ l
ტასმანია	t ʼ ɑ s m ɑ n i ɑ
ტექნიკურად	t ʼ ɛ kʰ n ɪ k ʼ u r ɑ d
ლიანა	l ɪ ɑ n ɑ
ბიძინა	b ɪ d z ɪ n ɑ
ცვალებადობა	t s v ɑ l ɛ b ɑ d ɔ b ɑ
მანქანები	m ɑ n kʰ ɑ n ɛ b ɪ
ყდა	q ʼ d ɑ
კულისებში	k ʼ u l ɪ s ɛ b ʃ ɪ
სვიტერი	s v ɪ t ʼ ɛ r ɪ
ძამია	d z ɑ m i ɑ
ირლანდია	ɪ r l ɑ n d ɪ ɑ
ნაკვერცხალი	n ɑ k ʼ v ɛ r t s x ɑ l i
ყოჩობა	q ʼ ɔ t ʃ ɔ b ɑ
სიმრავლე	s i m r ɑ v l ɛ
ფანატიკური	pʰ ɑ n ɑ t ʼ i k ʼ u r i
პალინდრომი	p ʼ ɑ l ɪ n d r ɔ m ɪ
უკანონობა	u k ʼ ɑ n ɔ n ɔ b ɑ
პომპონი	p ʼ ɔ m p ʼ ɔ n ɪ
მოძრაობა	m ɔ d z r ɑ ɔ b ɑ
მეაფთიაქე	m ɛ ɑ pʰ tʰ ɪ ɑ kʰ ɛ
ავოკადო	ɑ v ɔ k ʼ ɑ d ɔ
კორპუსი	k ʼ ɔ r p ʼ u s i
შორის	ʃ ɔ r ɪ s
მადლობელი	m ɑ d l ɔ b ɛ l ɪ
ინვენტარი	i n v ɛ n t ʼ ɑ r i
სენსუალიზმი	s ɛ n s u ɑ l ɪ z m ɪ
ზრდილობიანად	z r d ɪ l ɔ b ɪ ɑ n ɑ d
ასფალტი	ɑ s pʰ ɑ l t ʼ ɪ
უმჭიდროესი	u m t ʃ ʼ ɪ d r ɔ ɛ s ɪ
წარმოება	t s ʼ ɑ r m ɔ ɛ b ɑ
საკიდი	s ɑ k ʼ ɪ d ɪ
ტრაქტატი	t ʼ r ɑ kʰ t ʼ ɑ t ʼ ɪ
მეკვლე	m ɛ k ʼ v l ɛ
მამიკო	m ɑ m i k ʼ ɔ
გენეტიკოსი	ɡ ɛ n ɛ t ʼ ɪ k ʼ ɔ s ɪ
აპრიორული	ɑ p ʼ r ɪ ɔ r u l ɪ
ჩუსტი	t ʃ u s t ʼ i
უანგარო	u ɑ n ɡ ɑ r ɔ
მნათე	m n ɑ tʰ ɛ
საჭურველი	s ɑ t ʃ ʼ u r v ɛ l ɪ
მელანი	m ɛ l ɑ n ɪ
მელოდრამა	m ɛ l ɔ d r ɑ m ɑ
პუბლიკაცია	p ʼ u b l ɪ k ʼ ɑ t s ɪ ɑ
მაგნიტი	m ɑ ɡ n i t ʼ i
ზამბარაკიანი	z ɑ m b ɑ r ɑ k ʼ ɪ ɑ n ɪ
ძიძა	d z ɪ d z ɑ
იარუსი	ɪ ɑ r u s ɪ
აფხაზეთად	ɑ pʰ χ ɑ z ɛ tʰ ɑ d
ფაქტობრივი	pʰ ɑ kʰ t ʼ ɔ b r i v i
არახჩინი	ɑ r ɑ χ t ʃ ɪ n ɪ
მთის	m tʰ i s
პედიატრი	p ʼ ɛ d i ɑ t ʼ r i
აკროსტიქი	ɑ k ʼ r ɔ s t ʼ ɪ kʰ ɪ
უნივერსიტეტის	u n ɪ v ɛ r s ɪ t ʼ ɛ t ʼ ɪ s
ავტოსტოპით	ɑ v t ʼ ɔ s t ʼ ɔ p ʼ ɪ tʰ
შეთე	ʃ ɛ tʰ ɛ
აკვარელი	ɑ k ʼ v ɑ r ɛ l ɪ
ხატავს	χ ɑ t ʼ ɑ v s
აზღუდი	ɑ z ɣ u d i
ასული	ɑ s u l i
გადასაზიდი	ɡ ɑ d ɑ s ɑ z ɪ d ɪ
თვითნასწავლი	tʰ v ɪ tʰ n ɑ s t s ʼ ɑ v l ɪ
რაზმი	r ɑ z m ɪ
ბუკლეტი	b u k ʼ l ɛ t ʼ ɪ
კაპიტალისტი	k ʼ ɑ p ʼ ɪ t ʼ ɑ l ɪ s t ʼ ɪ
დაცვამ	d ɑ t s v ɑ m
ამბოხებული	ɑ m b ɔ χ ɛ b u l ɪ
ავლაბარი	ɑ v l ɑ b ɑ r i
სიცხე	s i t s x ɛ
მეწყალსადენე	m ɛ t s ʼ q ʼ ɑ l s ɑ d ɛ n ɛ
ნოტაცია	n ɔ t ʼ ɑ t s ɪ ɑ
უბერავს	u b ɛ r ɑ v s
კორპი	k ʼ ɔ r p ʼ ɪ
პორტი	p ʼ ɔ r t ʼ ɪ
გაერთიანებული	ɡ ɑ ɛ r tʰ i ɑ n ɛ b u l i
კურწი	k ʼ u r t s ʼ i
ხვრეპა	χ v r ɛ p ʼ ɑ
მამაჩემად	m ɑ m ɑ t ʃ ɛ m ɑ d
ქრონიკულად	kʰ r ɔ n ɪ k ʼ u l ɑ d
მზიანი	m z ɪ ɑ n ɪ
პაროლი	p ʼ ɑ r ɔ l ɪ
თანაზომადი	tʰ ɑ n ɑ z ɔ m ɑ d ɪ
სასხორი	s ɑ s x ɔ r i
სათანადო	s ɑ tʰ ɑ n ɑ d ɔ
კაცუნა	k ʼ ɑ t s u n ɑ
ქმნილება	kʰ m n ɪ l ɛ b ɑ
ციკლონური	t s ɪ k ʼ l ɔ n u r ɪ
ჯიბგირი	d ʒ ɪ b ɡ ɪ r ɪ
სისრულე	s ɪ s r u l ɛ
გოგოებად	ɡ ɔ ɡ ɔ ɛ b ɑ d
რეპორტიორი	r ɛ p ʼ ɔ r t ʼ ɪ ɔ r ɪ
ბანქო	b ɑ n kʰ ɔ
ფართოდ	pʰ ɑ r tʰ ɔ d
პადუა	p ʼ ɑ d u ɑ
ბავშვობა	b ɑ v ʃ v ɔ b ɑ
დიასახლისი	d ɪ ɑ s ɑ χ l ɪ s ɪ
კოკოტი	k ʼ ɔ k ʼ ɔ t ʼ i
ლევანტი	l ɛ v ɑ n t ʼ ɪ
არასაჭირო	ɑ r ɑ s ɑ t ʃ ʼ ɪ r ɔ
მყარი	m q ʼ ɑ r i
ჭვირი	t ʃ ʼ v ɪ r ɪ
პერიოდად	p ʼ ɛ r ɪ ɔ d ɑ d
ძირს	d z ɪ r s
არაგრამატიკულად	ɑ r ɑ ɡ r ɑ m ɑ t ʼ ɪ k ʼ u l ɑ d
ქლოროფილი	kʰ l ɔ r ɔ pʰ ɪ l ɪ
თარაზო	tʰ ɑ r ɑ z ɔ
გურმანი	ɡ u r m ɑ n ɪ
განურჩევლად	ɡ ɑ n u r t ʃ ɛ v l ɑ d
ობერტონი	ɔ b ɛ r t ʼ ɔ n ɪ
ბურბონი	b u r b ɔ n ɪ
ნაკერი	n ɑ k ʼ ɛ r i
ევროპას	ɛ v r ɔ p ʼ ɑ s
თავგადასავალი	tʰ ɑ v ɡ ɑ d ɑ s ɑ v ɑ l i
ლექტორი	l ɛ kʰ t ʼ ɔ r ɪ
აუცილებელი	ɑ u t s ɪ l ɛ b ɛ l ɪ
ტრილოგია	t ʼ r ɪ l ɔ ɡ ɪ ɑ
ნევროზი	n ɛ v r ɔ z i
საგა	s ɑ ɡ ɑ
უნდობლობა	u n d ɔ b l ɔ b ɑ
ჟღვლემ	ʒ ʁ v l ɛ m
გავლენა	ɡ ɑ v l ɛ n ɑ
პესტიციდი	p ʼ ɛ s t ʼ ɪ t s ɪ d ɪ
დუელისტი	d u ɛ l ɪ s t ʼ ɪ
ბარჯი	b ɑ r d ʒ i
ნესტო	n ɛ s t ʼ ɔ
ბაქარა	b ɑ kʰ ɑ r ɑ
არქიტექტურა	ɑ r kʰ ɪ t ʼ ɛ kʰ t ʼ u r ɑ
ბრალი	b r ɑ l i
აჩუმებს	ɑ t ʃ u m ɛ b s
ონტოლოგია	ɔ n t ʼ ɔ l ɔ ɡ ɪ ɑ
დათმობით	d ɑ tʰ m ɔ b ɪ tʰ
იაფფასიანი	ɪ ɑ pʰ pʰ ɑ s ɪ ɑ n ɪ
მტკაველი	m t ʼ k ʼ ɑ v ɛ l i
დოყლაპია	d ɔ q ʼ l ɑ p ʼ i ɑ
ტვირთი	t ʼ v ɪ r tʰ ɪ
ცინიკურად	t s ɪ n ɪ k ʼ u r ɑ d
კევი	k ʼ ɛ v i
რაფსოდია	r ɑ pʰ s ɔ d ɪ ɑ
რუბლი	r u b l ɪ
რიგი	r i ɡ i
შვეიცარული	ʃ v ɛ ɪ t s ɑ r u l ɪ
ზაირი	z ɑ ɪ r ɪ
აგენტურა	ɑ ɡ ɛ n t ʼ u r ɑ
ბაყაყი	b ɑ q ʼ ɑ q ʼ i
მრავალი	m r ɑ v ɑ l i
მოხერხებული	m ɔ x ɛ r x ɛ b u l i
რიგიანად	r ɪ ɡ ɪ ɑ n ɑ d
ცალფიცარი	t s ɑ l pʰ ɪ t s ɑ r ɪ
ამორჩეული	ɑ m ɔ r t ʃ ɛ u l ɪ
ვეწევი	v ɛ t s ʼ ɛ v i
უხმაუროდ	u χ m ɑ u r ɔ d
მუსიკად	m u s ɪ k ʼ ɑ d
სალათი	s ɑ l ɑ tʰ ɪ
სიჯიუტე	s ɪ d ʒ ɪ u t ʼ ɛ
ჩონგური	t ʃ ɔ n ɡ u r i
აირწინაღი	ɑ ɪ r t s ʼ ɪ n ɑ ʁ ɪ
ფილმი	pʰ ɪ l m ɪ
ვივისექცია	v ɪ v ɪ s ɛ kʰ t s ɪ ɑ
ძუძუ	d z u d z u
ვარიაცია	v ɑ r ɪ ɑ t s ɪ ɑ
ხვარამზე	χ v ɑ r ɑ m z ɛ
ათესვინებს	ɑ tʰ ɛ s v i n ɛ b s
უთანაბრობა	u tʰ ɑ n ɑ b r ɔ b ɑ
თავდაცვითი	tʰ ɑ v d ɑ t s v ɪ tʰ ɪ
წერტილი	t s ʼ ɛ r t ʼ i l i
სტატიკურად	s t ʼ ɑ t ʼ ɪ k ʼ u r ɑ d
გადამწყვეტად	ɡ ɑ d ɑ m t s ʼ q ʼ v ɛ t ʼ ɑ d
აღდგენადი	ɑ ʁ d ɡ ɛ n ɑ d ɪ
პრაგმატული	p ʼ r ɑ ɡ m ɑ t ʼ u l ɪ
ტიპოგრაფიულად	t ʼ ɪ p ʼ ɔ ɡ r ɑ pʰ ɪ u l ɑ d
პესო	p ʼ ɛ s ɔ
აზრიანად	ɑ z r ɪ ɑ n ɑ d
ვარამი	v ɑ r ɑ m ɪ
ჭარბი	t ʃ ʼ ɑ r b ɪ
იაკი	i ɑ k ʼ i
ავხორცობა	ɑ v χ ɔ r t s ɔ b ɑ
უვნებლად	u v n ɛ b l ɑ d
ორმოცდათექვსმეტი	ɔ r m ɔ t s d ɑ tʰ ɛ kʰ v s m ɛ t ʼ i
განმეორებითი	ɡ ɑ n m ɛ ɔ r ɛ b ɪ tʰ ɪ
უსარგებლობა	u s ɑ r ɡ ɛ b l ɔ b ɑ
ბროში	b r ɔ ʃ i
მოკრივე	m ɔ k ʼ r ɪ v ɛ
იაფი	i ɑ pʰ i
ქერცლი	kʰ ɛ r t s l ɪ
ხავერდოვანი	χ ɑ v ɛ r d ɔ v ɑ n ɪ
მამცურად	m ɑ m t s u r ɑ d
არამყარად	ɑ r ɑ m q ʼ ɑ r ɑ d
კრიტიკა	k ʼ r ɪ t ʼ ɪ k ʼ ɑ
აქტივაცია	ɑ kʰ t ʼ ɪ v ɑ t s ɪ ɑ
ზიმბაბვე	z i m b ɑ b v ɛ
ფოჩი	pʰ ɔ t ʃ ɪ
დედამიწად	d ɛ d ɑ m ɪ t s ʼ ɑ d
ბანკს	b ɑ n k ʼ s
დემონური	d ɛ m ɔ n u r ɪ
ვერაგად	v ɛ r ɑ ɡ ɑ d
იასამანი	ɪ ɑ s ɑ m ɑ n ɪ
ინტრავენურად	ɪ n t ʼ r ɑ v ɛ n u r ɑ d
სათვალიანი	s ɑ tʰ v ɑ l ɪ ɑ n ɪ
მჟავე	m ʒ ɑ v ɛ
გეოლოგიური	ɡ ɛ ɔ l ɔ ɡ i u r i
ფლოქსი	pʰ l ɔ kʰ s ɪ
იაპონიად	ɪ ɑ p ʼ ɔ n ɪ ɑ d
ზელანდიური	z ɛ l ɑ n d ɪ u r ɪ
ნეგუსი	n ɛ ɡ u s ɪ
მერხი	m ɛ r χ ɪ
ფაშატი	pʰ ɑ ʃ ɑ t ʼ ɪ
ბაზრობა	b ɑ z r ɔ b ɑ
საკიდარი	s ɑ k ʼ ɪ d ɑ r ɪ
აუქციონი	ɑ u kʰ t s ɪ ɔ n ɪ
გაფენს	ɡ ɑ pʰ ɛ n s
შუამავალი	ʃ u ɑ m ɑ v ɑ l i
შეუგნებლად	ʃ ɛ u ɡ n ɛ b l ɑ d
მოწაფე	m ɔ t s ʼ ɑ pʰ ɛ
ანდრია	ɑ n d r ɪ ɑ
პრეისტორია	p ʼ r ɛ ɪ s t ʼ ɔ r ɪ ɑ
აფიქსი	ɑ pʰ ɪ kʰ s ɪ
სეზონურად	s ɛ z ɔ n u r ɑ d
ფლეიტა	pʰ l ɛ i t ʼ ɑ
მიშად	m ɪ ʃ ɑ d
ლობისტი	l ɔ b ɪ s t ʼ ɪ
ჩაი	t ʃ ɑ ɪ
ხილი	χ ɪ l ɪ
პრელუდია	p ʼ r ɛ l u d ɪ ɑ
როგორ	r ɔ ɡ ɔ r
ანგელოზივით	ɑ n ɡ ɛ l ɔ z ɪ v ɪ tʰ
ხორუმი	x ɔ r u m i
ისტორიამ	ɪ s t ʼ ɔ r ɪ ɑ m
ლექსიკური	l ɛ kʰ s i k ʼ u r i
ხმას	χ m ɑ s
გლადიატორი	ɡ l ɑ d ɪ ɑ t ʼ ɔ r ɪ
წარმართული	t s ʼ ɑ r m ɑ r tʰ u l ɪ
რაჯი	r ɑ d ʒ ɪ
ყინული	q ʼ i n u l i
ჯავშანი	d ʒ ɑ v ʃ ɑ n ɪ
მატრიარქატი	m ɑ t ʼ r ɪ ɑ r kʰ ɑ t ʼ ɪ
კომპაქტურად	k ʼ ɔ m p ʼ ɑ kʰ t ʼ u r ɑ d
კოლონიზაცია	k ʼ ɔ l ɔ n ɪ z ɑ t s ɪ ɑ
წინასწარი	t s ʼ ɪ n ɑ s t s ʼ ɑ r ɪ
ეპისტოლე	ɛ p ʼ ɪ s t ʼ ɔ l ɛ
ფითილი	pʰ i tʰ i l i
ვეზირი	v ɛ z ɪ r ɪ
ჯეილი	d ʒ ɛ ɪ l ɪ
ღვარძლი	ʁ v ɑ r d z l ɪ
უწესრიგობაში	u t s ʼ ɛ s r ɪ ɡ ɔ b ɑ ʃ ɪ
პერანგი	p ʼ ɛ r ɑ n ɡ i
კმაყოფილი	k ʼ m ɑ q ʼ ɔ pʰ i l i
გრძნეულება	ɡ r d z n ɛ u l ɛ b ɑ
წერა	t s ʼ ɛ r ɑ
შებრუნებული	ʃ ɛ b r u n ɛ b u l ɪ
ლაპარაკი	l ɑ p ʼ ɑ r ɑ k ʼ i
გვალვიანობა	ɡ v ɑ l v ɪ ɑ n ɔ b ɑ
მატყლი	m ɑ t ʼ q ʼ l i
სინანული	s ɪ n ɑ n u l ɪ
კაპიუშონი	k ʼ ɑ p ʼ ɪ u ʃ ɔ n ɪ
რაები	r ɑ ɛ b i
კლდე	k ʼ l d ɛ
მითითებამ	m ɪ tʰ ɪ tʰ ɛ b ɑ m
მანაგუა	m ɑ n ɑ ɡ u ɑ
ჩიბუხი	t ʃ i b u x i
სუდანი	s u d ɑ n ɪ
პრობლემატური	p ʼ r ɔ b l ɛ m ɑ t ʼ u r ɪ
კორპორაციული	k ʼ ɔ r p ʼ ɔ r ɑ t s ɪ u l ɪ
დაცლილი	d ɑ t s l i l i
კოლონია	k ʼ ɔ l ɔ n ɪ ɑ
მწუხრი	m t s ʼ u x r i
კატლეტი	k ʼ ɑ t ʼ l ɛ t ʼ i
მჭლედ	m t ʃ ʼ l ɛ d
წინდიანი	t s ʼ ɪ n d ɪ ɑ n ɪ
ლაქა	l ɑ kʰ ɑ
რაციონალისტი	r ɑ t s ɪ ɔ n ɑ l ɪ s t ʼ ɪ
ნაციონალი	n ɑ t s i ɔ n ɑ l i
ქვეყანამ	kʰ v ɛ q ʼ ɑ n ɑ m
რეჟისორი	r ɛ ʒ ɪ s ɔ r ɪ
კრებულები	k ʼ r ɛ b u l ɛ b ɪ
ბერტყავს	b ɛ r t ʼ q ʼ ɑ v s
აცხობს	ɑ t s x ɔ b s
გახსნა	ɡ ɑ χ s n ɑ
კლიმატურად	k ʼ l ɪ m ɑ t ʼ u r ɑ d
კაფსული	k ʼ ɑ pʰ s u l ɪ
შარლი	ʃ ɑ r l ɪ
მოსამსახურე	m ɔ s ɑ m s ɑ x u r ɛ
ინგლისმა	ɪ n ɡ l ɪ s m ɑ
ნიჭიერება	n ɪ t ʃ ʼ ɪ ɛ r ɛ b ɑ
თამბაქო	tʰ ɑ m b ɑ kʰ ɔ
მიმბაძველად	m ɪ m b ɑ d z v ɛ l ɑ d
მუყაითი	m u q ʼ ɑ i tʰ i
ვირტუალურად	v ɪ r t ʼ u ɑ l u r ɑ d
დაბრუნდება	d ɑ b r u n d ɛ b ɑ
