nielsen	n i l s ɛ nː
upplýsing	ʏ h p l iː s i ŋ k
okkur	ɔ h k ʏ r
mosagróinn	m ɔː s a k r o uː ɪ nː
verkaskipting	v ɛ r̥ k a s c ɪ f t i ŋ k
bak	p aː k
milli	m ɪ t l ɪ
afmælisgjöf	a v m a iː l ɪ s c œː v
forstjóri	f ɔ r̥ s t j o uː r ɪ
hækill	h a i cː ɪ t l
klettafrú	kʰ l ɛ h t a f r uː
mysa	m ɪː s a
töng	tʰ ø y ŋ k
bardagi	p a r t aː j ɪ
gletta	k l ɛ h t a
stari	s t aː r ɪ
teygja	tʰ e iː j a
jóhann	j o uː h a nː
durgslegur	t ʏ r k s l ɛː ɣ ʏ r
hnífur	n̥ iː v ʏ r
sjón	s j o uː n
hróarskelda	r̥ o uː a r̥ s cʰ ɛ l t a
sund	s ʏ n t
hús	h uː s
hvatning	xʷ a h t n i ŋ k
töfra	tʰ œ v r a
sifjaspell	s ɪ v j a s p ɛ t l
lottó	l ɔ h t o uː
heilla	h e i t l a
botnlangaskurður	p ɔ h t n l a u ŋ k a s k ʏ r ð ʏ r
hróp	r̥ o uː p
dofi	t ɔː v ɪ
brautryðjandi	p r ø yː t r ɪ ð j a n t ɪ
þvottur	θ v ɔ h t ʏ r
skaplyndi	s k aː p l ɪ n t ɪ
samkvæmt	s a m k ʱ v a i m̥ t
stóriburkni	s t o uː r ɪ p ʏ r̥ k n ɪ
gígja	c iː j a
aðgerðaáætlun	a ð c ɛ r ð aː u a i t l ʏ n
hagnaður	h a k n a ð ʏ r
lýsingarháttur	l iː s i ŋ k a r h a u h t ʏ r
herðar	h ɛ r ð a r
héla	ç ɛː l a
kex	cʰ ɛ x s
kappi	kʰ a h p ɪ
hver	kʰ v ɛː r
markaður	m a r̥ k a ð ʏ r
par	pʰ aː r
ofbeldi	ɔ v p ɛ l t ɪ
lund	l ʏ n t
málsgrein	m a u l s k r e iː n
aur	ø yː r
deita	t e iː t a
fjölveri	f j œ l v ɛː r ɪ
heimboð	h e i m p ɔː ð
beiða	p e iː ð a
lind	l ɪ n t
tjald	tʰ j a l t
yfirráð	ɪː v ɪ r r a uː ð
byggð	p ɪ ɣ ð
banki	p a u ɲ̊ c ɪ
snurða	s t n ʏ r ð a
prag	pʰ r aː ɣ
kistill	cʰ ɪ s t ɪ t l
náttúra	n a u h t uː r a
heild	h e i l t
fíkinn	f iː c ɪ nː
títt	tʰ i h t
valdimaría	v a l t ɪ m aː r iː j a
fjall	f j a t l
kyrkingur	cʰ ɪ r̥ c i ŋ k ʏ r
ax	a x s
stóðgarður	s t o u ð k a r ð ʏ r
skeina	s c e iː n a
hnetusmjör	n̥ ɛː t ʏ s m j œː r
páll	pʰ a u t l
persneska	pʰ ɛ r̥ s n ɛ s k a
oj	ɔ iː
farði	f a r ð ɪ
mikill	m ɪː c ɪ t l
vax	v a k s
latur	l aː t ʏ r
soffía	s ɔ fː iː j a
saurblað	s ø y r p l aː ð
óhapp	o uː h a h p
rússneska	r u sː n ɛ s k a
föðurlandsvinur	f œː ð ʏ r l a n s v ɪː n ʏ r
óreglulegur	o uː r ɛ k l ʏ l ɛː ɣ ʏ r
stýrikerfi	s t iː r ɪ cʰ ɛ r v ɪ
leg	l ɛː ɣ
dæma	t a iː m a
hnoðri	n̥ ɔ ð r ɪ
söl	s œː l
hroki	r̥ ɔː c ɪ
kyrkja	cʰ ɪ r̥ c a
kasta	kʰ a s t a
slóvakía	s t l o uː v a cʰ iː j a
hallur	h a t l ʏ r
fagurblár	f aː ɣ ʏ r p l a uː r
lífdagar	l i v t aː ɣ a r
einbirni	e i n p ɪ r t n ɪ
eistalyppa	e i s t a l ɪ h p a
jarðfræði	j a r ð f r a iː ð ɪ
loðvíðir	l ɔ ð v iː ð ɪ r
panta	pʰ a n̥ t a
andvari	a n t v aː r ɪ
hrekja	r̥ ɛː c a
þess	θ ɛ sː
segulljós	s ɛː ɣ ʏ l l j o uː s
stappa	s t a h p a
frú	f r uː
dugnaður	t ʏ ɣ n aː ð ʏ r
handrit	h a n t r ɪː t
köllun	kʰ œ t l ʏ n
farmiði	f a r m ɪː ð ɪ
kelfing	cʰ ɛ l v i ŋ k
söngkona	s ø y ŋ k kʰ ɔː n a
bið	p ɪː ð
benda	p ɛ n t a
karbónat	kʰ a r p o uː n aː t
nærvera	n a i r v ɛː r a
smásjá	s m a uː s j a uː
tónleikar	tʰ o u n l e iː k a r
montinn	m ɔ n̥ t ɪ nː
snerra	s n ɛ rː a
iðn	ɪ ð n
steindór	s t e i n t o uː r
gashylki	k aː s h ɪ l̥ c ɪ
orsaka	ɔ r̥ s aː k a
auðveldlega	ø y ð v ɛ l t l ɛː ɣ a
sínus	s iː n ʏ s
klettur	kʰ l ɛ h t ʏ r
álma	a u l m a
þola	θ ɔː l a
alls	a l s
þor	θ ɔː r
nokkur	n ɔ h k ʏ r
undanfari	ʏ n t a n f aː r ɪ
forseti	f ɔ r̥ s ɛː t ɪ
kæpa	cʰ a iː p a
áhersla	a uː h ɛ r̥ s t l a
krossmaðra	kʰ r ɔ sː m a ð r a
nátthrafn	n a u h t r̥ a p n
vök	v œː k
vöðvi	v œ ð v ɪ
gráhegri	k r a uː h ɛ ɣ r ɪ
langreyður	l a u ŋ k r e iː ð ʏ r
hirðuleysi	h ɪ r ð ʏ l e iː s ɪ
as	aː s
egna	ɛ k n a
næði	n a iː ð ɪ
járna	j a u t n a
aðsókn	a ð s o u h k n
glæta	k l a iː t a
settaug	s ɛː t tʰ ø yː ɣ
efnaskipti	ɛ p n a s c ɪ f t ɪ
ásjálegur	a uː s j a uː l ɛː ɣ ʏ r
bjórvömb	p j o u r v œ m p
kvíða	kʰ v iː ð a
ábendingarfornafn	a uː p ɛ n t i ŋ k a r f ɔ r n a p n
baga	p aː ɣ a
broddfura	p r ɔ tː f ʏː r a
níð	n iː ð
tvímynd	tʰ v iː m ɪ n t
ofursti	ɔː f ʏ r̥ s t ɪ
írland	i r l a n t
amma	a mː a
hnúfubakur	n̥ uː v ʏ p aː k ʏ r
hrúður	r̥ uː ð ʏ r
mysuostur	m ɪː s ʏ ɔ s t ʏ r
sullur	s ʏ t l ʏ r
tafl	tʰ a p l
vakna	v a h k n a
bolla	p ɔ t l a
forsetning	f ɔ r̥ s ɛ h t n i ŋ k
hrjósa	r̥ j o uː s a
grín	k r iː n
njálgur	n j a u l k ʏ r
eftirminnilegur	ɛ f t ɪ r m ɪ nː ɪ l ɛː ɣ ʏ r
kragi	kʰ r a iː j ɪ
vænir	v a iː n ɪ r
renta	r ɛ n̥ t a
flenna	f l ɛ nː a
saltkjöt	s a l̥ t cʰ œː t
kirjálaland	cʰ ɪ r j a uː l a l a n t
kommi	kʰ ɔ mː ɪ
júlí	j uː l iː
grunnskóli	k r ʏ nː s k o uː l ɪ
ákafur	a uː k aː v ʏ r
nytsamur	n ɪː t s aː m ʏ r
þjöl	θ j œː l
brúskur	p r u s k ʏ r
megna	m ɛ k n a
fróðný	f r o u ð n iː
rót	r o uː t
frymi	f r ɪː m ɪ
butur	p ʏː t ʏ r
skömm	s k œ mː
flagasef	f l aː ɣ a s ɛː v
runnur	r ʏ nː ʏ r
nafar	n aː v a r
kyssa	cʰ ɪ sː a
hrái	r̥ a uː ɪ
grár	k r a uː r
gepill	c ɛː p ɪ t l
sin	s ɪː n
þyrstur	θ ɪ r̥ s t ʏ r
heimsálfa	h e i m s a u l v a
fimbulvetur	f ɪ m p ʏ l v ɛː t ʏ r
fés	f j ɛː s
roða	r ɔː ð a
hundrað	h ʏ n t r aː ð
afturbatapíka	a f tʰ ʏ r p aː tʰ a pʰ iː kʰ a
nauðsyn	n ø y ð s ɪː n
kína	cʰ iː n a
lotugræðgi	l ɔː t ʏ k r a i ð c ɪ
skipaskurður	s c ɪː p a s k ʏ r ð ʏ r
sigg	s ɪ kː
hóruhús	h o uː r ʏ h uː s
sál	s a uː l
tá	tʰ a uː
fyl	f ɪː l
guðspjall	k v ʏ ð s p j a t l
göng	k ø y ŋ k
vigt	v ɪ x t
rauf	r ø yː v
eigra	e i ɣ r a
frumulíffæri	f r ʏː m ʏ l i f f a iː r ɪ
hákarl	h aː k a r t l
lundir	l ʏ n t ɪ r
svengja	s v e i ɲ c a
hræðilega	r̥ a iː ð ɪ l ɛː ɣ a
ægja	a iː j a
uml	ʏ m l
breidd	p r e i tː
færni	f a i r t n ɪ
botnfall	p ɔ h t n f a t l
þrymskviða	θ r ɪ m s kʰ v ɪː ð a
veikur	v e iː k ʏ r
burkni	p ʏ r̥ k n ɪ
gretta	k r ɛ h t a
framsöguháttur	f r a m s œː ɣ ʏ h a u h t ʏ r
héri	ç ɛː r ɪ
ósíris	o uː s iː r ɪ s
kuldi	kʰ ʏ l t ɪ
urt	ʏ r̥ t
portúgalska	p ɔ r̥ t uː k a l s k a
brennisóley	p r ɛ nː ɪ s o uː l e iː
hjörtur	ç œ r̥ t ʏ r
hlutgrúpa	l̥ ʏː t k r uː p a
brauðrist	p r ø y ð r ɪ s t
meðlimur	m ɛ ð l ɪː m ʏ r
ákavíti	a uː k a v iː t ɪ
rugl	r ʏ k l
krydd	kʰ r ɪ tː
evklíð	ɛ v kʰ l iː ð
konungshöll	kʰ ɔː n u ŋ k s h œ t l
fastanefnd	f a s t a n ɛ m t
stjórnmál	s t j o u r t n m a uː l
ský	s c iː
bel	p ɛː l
augnlok	ø y k n l ɔː k
loppa	l ɔ h p a
metanól	m ɛː tʰ aː n o uː l
hjartastillir	ç a r̥ t a s t ɪ t l ɪ r
hraustur	r̥ ø y s t ʏ r
eyðsla	e i ð s t l a
láfi	l a uː v ɪ
ferðaáætlun	f ɛ r ð a a uː a i h t l ʏ n
klarínett	kʰ l aː r iː n ɛ h t
kelta	cʰ ɛ l̥ t a
túndra	tʰ u n t r a
hes	h ɛː s
smjatt	s m j a h t
knipla	kʰ n ɪ h p l a
torg	tʰ ɔ r k
nál	n a uː l
þristur	θ r ɪ s t ʏ r
röskur	r œ s k ʏ r
kynsjúkdómur	cʰ ɪ n s j uː k t o uː m ʏ r
armur	a r m ʏ r
signa	s ɪ k n a
meðstjórnendur	m ɛ ð s t j o u r t n ɛ n t ʏ r
lítri	l iː t r ɪ
græja	k r a iː j a
landi	l a n t ɪ
bragliður	p r a ɣ l ɪː ð ʏ r
aldrei	a l t r e iː
marr	m a rː
íkornabygg	iː kʰ ɔ r t n a p ɪ kː
ráðríkur	r a u ð r iː k ʏ r
lægja	l a iː j a
floti	f l ɔː t ɪ
keisaraviður	cʰ e iː s aː r a v ɪː ð ʏ r
jafnaðarstefna	j a p n aː ð a r s t ɛ p n a
strangur	s t r a u ŋ k ʏ r
tíkarsonur	tʰ iː k a r s ɔː n ʏ r
ástríður	a u s t r iː ð ʏ r
vefur	v ɛː v ʏ r
breiddargráða	p r e i tː a r k r a uː ð a
umla	ʏ m l a
mæði	m a iː ð ɪ
miltisbrandur	m ɪ l̥ t ɪ s p r a n t ʏ r
háttur	h a u h t ʏ r
vík	v iː k
vax	v a x s
óvinátta	o uː v ɪː n a u h t a
viðeigandi	v ɪː ð e iː ɣ a n t ɪ
maskari	m a s k aː r i
frost	f r ɔ s t
briem	p r iː m
húðsjúkdómafræðingur	h uː ð s j u k t o uː m a f r a iː ð i ŋ k ʏ r
skokka	s k ɔ h k a
kóða	kʰ o uː ð a
klórópren	kʰ l o uː r o uː pʰ r ɛː n
stjórnmálamaður	s t j o u r t n m a uː l a m aː ð ʏ r
þrúður	θ r uː ð ʏ r
hníga	n̥ iː ɣ a
hersegóvína	h ɛ r̥ s ɛː k o uː v iː n a
líma	l iː m a
gap	k aː p
völva	v œ l v a
brátt	p r a u h t
hóta	h o uː t a
grúpa	k r uː p a
húfa	h uː v a
magnea	m a k n ɛː a
ansi	a n s ɪ
lekur	l ɛː k ʏ r
heimaverkefni	h e iː m a v ɛ r̥ k ɛ p n ɪ
lóa	l o uː a
knús	kʰ n uː s
fjölbýlishús	f j œ l p iː l ɪ s h uː s
tréspíri	tʰ r j ɛː s p iː r ɪ
streyma	s t r e iː m a
herri	h ɛ rː ɪ
flæmska	f l a i m s k a
spæta	s p a iː t a
framvinda	f r a m v ɪ n t a
rándýr	r a u n t iː r
fylgdarmaður	f ɪ l t a r m aː ð ʏ r
kreppa	kʰ r ɛ h p a
vetur	v ɛː t ʏ r
klof	kʰ l ɔː v
snákur	s t n a uː k ʏ r
ögn	œ k n
segð	s ɛ ɣ ð
hjala	ç aː l a
svindl	s v ɪ n t l
kynleysi	cʰ ɪ n l e iː s ɪ
körfuknattleiksþjálfari	kʰ œ r v ʏ kʰ n a h t l e i k s θ j a u l v a r ɪ
kolkrabbi	kʰ ɔ l kʰ r a pː ɪ
unnur	ʏ nː ʏ r
kjarni	cʰ a r t n ɪ
sifjar	s ɪ v j a r
flæði	f l a iː ð ɪ
agn	a k n
kara	kʰ aː r a
megn	m ɛ k n
blóðmura	p l o u ð m ʏː r a
nót	n o uː t
kollhnís	kʰ ɔ t l n̥ iː s
vifta	v ɪ f t a
þorna	θ ɔ r t n a
hnútafræði	n̥ uː t a f r a iː ð ɪ
slasa	s t l aː s a
svali	s v aː l ɪ
peyi	pʰ e iː j ɪ
hálfleikur	h a u l v l e iː k ʏ r
illmælgi	ɪ t l m a i l c ɪ
lín	l iː n
hnísa	n̥ iː s a
hestaleiga	h ɛ s t a l e iː ɣ a
sýnishorn	s iː n ɪ s h ɔ t n
steinbrjótur	s t e i n p r j o uː t ʏ r
keisari	cʰ e iː s aː r ɪ
bónus	p o uː n ʏ s
kvikmyndahús	kʰ v ɪː k m ɪ n t a h uː s
leikmynd	l e iː k m ɪ n t
tjara	tʰ j aː r a
froskdýr	f r ɔ s k t iː r
skaft	s k a f t
pissuskál	pʰ ɪ sː ʏ s k a uː l
pexa	pʰ ɛ x s a
jarðskjálftafræði	j a r ð s c a u l̥ t a f r a iː ð ɪ
útlit	uː t l ɪː t
durtur	t ʏ r̥ t ʏ r
klunni	kʰ l ʏ nː ɪ
snóker	s t n o uː k ɛ r
stökkva	s t œ h k v a
mjólkurferna	m j o u l̥ k ʏ r f ɛ r t n a
naður	n aː ð ʏ r
afli	a p l ɪ
óbeinn	o uː p e i t n
uppsalir	ʏ h p s aː l ɪ r
nærmynd	n a i r m ɪ n t
lágur	l a uː r
sólhattur	s o u l h a h t ʏ r
kast	kʰ a s t
kærulaus	cʰ a iː r ʏ l ø yː s
barónett	p aː r o uː n ɛ h t
goðafræði	k ɔː ð a f r a iː ð ɪ
sverðfiskur	s v ɛ r ð f ɪ s k ʏ r
hetta	h ɛ h t a
elí	ɛː l iː
bóla	p o uː l a
hrollur	r̥ ɔ t l ʏ r
regla	r ɛ k l a
samþykkja	s a m θ ɪ h c a
grýla	k r iː l a
tattóvera	tʰ aʰ t o u v ɛ r a
gráði	k r a uː ð ɪ
varkár	v a r̥ kʰ a uː r
blóm	p l o uː m
húsnæði	h uː s n a iː ð ɪ
hylja	h ɪ l j a
stóla	s t o uː l a
klekja	kʰ l ɛː c a
marka	m a r̥ k a
túli	tʰ uː l ɪ
frjó	f r j o uː
klængur	kʰ l a i ŋ k ʏ r
trissa	tʰ r ɪ sː a
menga	m e i ŋ k a
fölur	f œː l ʏ r
hökutoppur	h œː k ʏ tʰ ɔ h p ʏ r
brons	p r ɔ n s
línulega	l iː n ʏ l ɛː ɣ a
jakuxi	j aː k ʏ k s ɪ
fjón	f j o uː n
útlenskur	uː t l ɛ n s k ʏ r
persónulega	pʰ ɛ r̥ s o uː n ʏ l ɛː ɣ a
stirðna	s t ɪ r t n a
motta	m ɔ h t a
sandali	s a n t a l ɪ
myndband	m ɪ n t p a n t
sigurðsson	s ɪː ɣ ʏ r ð s s ɔː n
hröngl	r̥ ø y ŋ l
tyrðill	tʰ ɪ r ð ɪ t l
hækka	h a i h k a
hreinsunareldur	r̥ e i n s ʏː n aː r ɛ l t ʏ r
ánamaðkur	a uː n a m a θ k ʏ r
vaff	v a fː
fönix	f œː n ɪ x s
fræ	f r a iː
dauðhreinsa	d ø y ð r̥ e i n s a
enskur	ɛ n s k ʏ r
nytsemi	n ɪː t s ɛː m ɪ
lækur	l a iː k ʏ r
félagi	f j ɛː l aː j ɪ
þvag	θ v aː ɣ
þeir	θ e iː r
ræfill	r a iː v ɪ t l
mannvirðing	m a nː v ɪ r ð i ŋ k
karp	kʰ a r̥ p
miltu	m ɪ l̥ t ʏ
hugur	h ʏː ɣ ʏ r
afrískur	aː f r i s k ʏ r
lauga	l ø yː ɣ a
týndur	tʰ i n t ʏ r
rjúka	r j uː k a
vana	v aː n a
læða	l a iː ð a
barð	p a r ð
egglos	ɛ kː l ɔː s
vafur	v aː v ʏ r
schiöth	s c œ h t
bolli	p ɔ t l ɪ
már	m a uː r
tvíhliða	tʰ v iː l̥ ɪː ð a
dagur	t aː ɣ ʏ r
leiðsla	l e i ð s t l a
ávalur	a uː v aː l ʏ r
askur	a s k ʏ r
gulmaðra	k ʏ l m a ð r a
gullfiskur	k ʏ t l f ɪ s k ʏ r
lirfa	l ɪ r v a
sæta	s a iː t a
glæða	k l a iː ð a
strætisvagn	s t r a iː t ɪ s v a k n
pasta	pʰ a s t a
eista	e i s t a
blágreni	p l a uː k r ɛː n ɪ
túnvingull	tʰ u n v i ŋ k ʏ t l
kóf	kʰ o uː v
pendúll	pʰ ɛ n t ʏ t l
ákafi	a uː kʰ aː v ɪ
frísneskur	f r iː s n ɛ s k ʏ r
mosi	m ɔː s ɪ
menntaskóli	m ɛ n̥ t a s k o uː l ɪ
flugstjóri	f l ʏ x s t j o uː r ɪ
smokkar	s m ɔ h k a r
hrufla	r̥ ʏ p l a
vagga	v a kː a
firð	f ɪ r ð
hlýðni	l̥ i ð n ɪ
grey	k r e iː
gáta	k a uː t a
svandís	s v a n t iː s
þorgeir	θ ɔ r k e iː r
sónatína	s o uː n a tʰ iː n a
storma	s t ɔ r m a
lampi	l a m̥ p ɪ
melgresi	m ɛ l k r ɛː s ɪ
tötrar	tʰ œː t r a r
litúrgískur	l ɪː tʰ u r c i s k ʏ r
teista	tʰ e i s t a
búð	p uː ð
stjórnleysi	s t j o u r t n l e iː s ɪ
morgunhani	m ɔ r k ʏ n h aː n ɪ
finni	f ɪ nː ɪ
æta	a iː t a
sendill	s ɛ n t ɪ t l
svigna	s v ɪ k n a
grunnli	k r ʏ nː l ɪ
labba	l a pː a
beittur	p e i h t ʏ r
erfiði	ɛ r v ɪː ð ɪ
hálmstrá	h a u l m s t r a uː
spil	s p ɪː l
geiri	c e iː r ɪ
anúbis	aː n uː p ɪ s
látún	l a uː t uː n
miða	m ɪː ð a
náhvalur	n a uː kʰ v aː l ʏ r
hnífasmiður	n̥ iː v a s m ɪː ð ʏ r
rauðrófa	r ø y ð r o uː v a
vélfræði	v j ɛ l f r a iː ð ɪ
gnægð	k n a i ɣ ð
trunta	t r ʏ n̥ t a
lestun	l ɛ s t ʏ n
hungur	h u ŋ k ʏ r
lamb	l a m p
fiðla	f ɪ ð l a
bróm	p r o uː m
lensa	l ɛ n s a
hreindýramosi	r̥ e i n t iː r a m ɔː s ɪ
stöð	s t œː ð
kjökra	cʰ œː k r a
gatari	k aː t aː r ɪ
flengur	f l e i ŋ k ʏ r
kaldur	kʰ a l t ʏ r
ágjarn	a uː c a r t n
sæll	s a i t l̥
máfur	m a uː v ʏ r
lerki	l ɛ r̥ c ɪ
spergilkál	s p ɛ r c ɪ l kʰ a uː l
kynnir	cʰ ɪ nː ɪ r
klápur	kʰ l a uː p ʏ r
urð	ʏ r ð
fleygja	f l e iː j a
gulur	k ʏː l ʏ r
krafa	kʰ r aː v a
tíðka	tʰ i θ k a
bárður	p a u r ð ʏ r
þyngd	θ i ŋ t
hanskahólf	h a n s k a h o u l v
ólífa	o uː l iː v a
nammi	n a mː ɪ
væla	v a iː l a
sef	s ɛː v
afrit	a v r ɪː t
sjáumst	s j aː u ʏ m̥ s t
fýldur	f i l t ʏ r
skyggn	s c ɪ k n
frábærlega	f r a uː p a i r l ɛː ɣ a
gneggja	k n ɛ cː a
djóka	t j o uː k a
pönk	pʰ ø y ŋ̊ k
græða	k r a iː ð a
skruma	s k r ʏː m a
grefill	k r ɛː v ɪ t l
kol	kʰ ɔː l
orfa	ɔ r v a
kynkvísl	cʰ ɪː n kʰ v i s t l
il	ɪː l
slark	s t l a r̥ k
droplaug	t r ɔː p l ø yː ɣ
springa	s p r i ŋ k a
andrés	a n t r j ɛː s
þrettán	θ r ɛ h t a uː n
dökkur	t œ h k ʏ r
skammkrækill	s k a mː kʰ r a iː c ɪ t l
kuldalegur	kʰ ʏ l t a l ɛː ɣ ʏ r
gaukur	k ø yː k ʏ r
hollenskur	h ɔ l l ɛ n s k ʏ r
samheitaorðabók	s a m h e iː t a ɔ r ð a p o uː k
grjón	k r j o uː n
geisli	c e i s t l ɪ
erla	ɛ r t l a
gotland	k ɔː t l a n t
bang	p a u ŋ k
mannréttindi	m a nː r j ɛ h t ɪ n t ɪ
gráspör	k r a uː s p œː r
dregill	t r e iː j ɪ t l
aldeilis	a l t e iː l ɪ s
tvívetni	tʰ v iː v ɛ h t n ɪ
sigfúsína	s ɪ x f uː s iː n a
kröfuganga	kʰ r œː v ʏ k a u ŋ k a
skurðgoð	s k ʏ r ð k ɔː d
særa	s a iː r a
ferhyrningur	f ɛ r h ɪ r t n i ŋ k ʏ r
þys	θ ɪː s
skjár	s c a uː r
fimma	f ɪ mː a
bátsferð	p a u t s f ɛ r ð
gítar	c iː tʰ aː r
krækja	kʰ r a iː c a
skóglaus	s k o u ɣ l ø yː s
ingimundur	i ɲ c ɪ m ʏ n t ʏ r
danska	t a n s k a
kyrtill	cʰ ɪ r̥ t ɪ t l
dúkur	t uː k ʏ r
nekt	n ɛ x t
pína	pʰ iː n a
afturhaldsstefna	a f t ʏ r h a l t s s t ɛ p n a
gredda	k r ɛ tː a
árstími	a u r s tʰ iː m ɪ
klipping	kʰ l ɪ h p i ŋ k
andaglas	a n t a k l aː s
lögmaður	l œ ɣ m aː ð ʏ r
gella	c ɛ lː a
rif	r ɪː v
ykkar	ɪ h k ɐ r
bland	p l a n t
engi	e i ɲ c ɪ
sameind	s aː m e i n t
lánsþýðing	l a u n s θ iː ð i ŋ k
húm	h uː m
jarðsprengja	j a r ð s p r e i ɲ c a
hálendi	h a uː l ɛ n t ɪ
ferstrendingur	f ɛ r̥ s t r ɛ n t i ŋ k ʏ r
kvap	kʰ v aː p
svalur	s v aː l ʏ r
handbolti	h a n t p ɔ l̥ t ɪ
hegna	h ɛ k n a
svæfill	s v a iː v ɪ t l
harpa	h a r̥ p a
hýena	h iː ɛ n a
cís	s iː s
indæll	ɪ n t a i t l
styrkleiki	s t ɪ r̥ k l e iː c ɪ
fjóla	f j o uː l a
smjör	s m j œː r
tryggur	tʰ r ɪ kː ʏ r
hryssingslegur	r̥ ɪ sː i ŋ k s l ɛː ɣ ʏ r
hjólhýsi	ç o u l h iː s ɪ
rakvél	r aː k v j ɛː l
hlað	l̥ aː ð
uppspretta	ʏ h p s p r ɛ h t a
etja	ɛː t j a
blóðormur	p l o uː ð ɔ r m ʏ r
aðalsetning	aː ð a l s ɛ h t n i ŋ k
fæðing	f a iː ð i ŋ k
blaðamaður	p l aː ð a m aː ð ʏ r
tilgangsfall	tʰ ɪ l k a u ŋ k s f a t l
rætur	r a iː t ʏ r
bílstjóri	p i l s t j o uː r ɪ
klípa	kʰ l iː p a
föl	f œː l
erfiðisvinna	ɛ r v ɪː ð ɪ s v ɪ nː a
vís	v iː s
skuldari	s k ʏ l t aː r ɪ
fas	f aː s
glundra	k l ʏ n t r a
þarna	θ a r t n a
náða	n a uː ð a
skjóla	s c o uː l a
asna	a s t n a
briskirtill	p r ɪː s cʰ ɪ r̥ t ɪ t l
lið	l ɪː ð
öryggisgirðing	œː r ɪ cː ɪ s c ɪ r ð i ŋ k
forritunarmál	f ɔ rː ɪː t ʏ n a r m a uː l
bros	p r ɔː s
fylja	f ɪ l j a
jarðsaga	j a r ð s aː ɣ a
nefnd	n ɛ m t
kústur	kʰ u s t ʏ r
fjalldrapi	f j a t l t r aː p ɪ
alnet	a l n ɛː t
forinta	f ɔː r ɪ n̥ t a
stjórn	s t j o u r t n
búlgaría	p u l k a r iː j a
storkur	s t ɔ r̥ k ʏ r
piparúði	pʰ ɪː p a r uː ð ɪ
málbein	m a u l p e iː n
svo	s v ɔː
múhameð	m uː h a m ɛː ð
mýrdalur	m i r t aː l ʏ r
kvars	kʰ v a r̥ s
spíra	s p iː r a
diskótek	t ɪ s k o uː tʰ ɛː k
frón	f r o uː n
logn	l ɔ k n
kafald	kʰ aː v a l t
plast	pʰ l a s t
rómur	r o uː m ʏ r
sítrónusafi	s iː tʰ r o uː n ʏ s aː v ɪ
blævængur	p l a iː v a i ŋ k ʏ r
útbreiðsla	uː t p r e i ð s t l a
notkun	n ɔ h t k ʏ n
blæösp	p l a iː œ s p
júlíus	j uː l iː j ʏ s
hvolfa	kʰ v ɔ l v a
agalegur	aː ɣ a l ɛ ɣ ʏ r
hólmur	h o u l m ʏ r
jarma	j a r m a
skær	s c a iː r
sonur	s ɔː n ʏ r
ekla	ɛ h k l a
sjóður	s j o uː ð ʏ r
ráðabrugg	r a uː ð a p r ʏ kː
kilja	cʰ ɪ l j a
malmquist	m a l m kʰ v ɪ s t
hvítá	xʷ iː t a uː
smekkur	s m ɛ h k ʏ r
leggur	l ɛ kː ʏ r
fengur	f e i ŋ k ʏ r
gramm	k r a mː
budda	p ʏ tː a
hvítlauksgeiri	kʰ v iː t l ø y k s c e iː r ɪ
klappa	k l a h p a
lensutungljurt	l ɛ n s ʏ tʰ u ŋ l j ʏ r̥ t
sögn	s œ k n
nökkvi	n œ h k v ɪ
heilsa	h e i l s a
öld	œ l t
guðjónína	k v ʏ ð j o uː n iː n a
hokkí	h ɔ h c iː
rotinn	r ɔː t ɪ nː
flekklaus	f l ɛ h k l ø yː s
áskrift	a uː s k r ɪ f t
sigmundur	s ɪ ɣ m ʏ n t ʏ r
menntun	m ɛ n̥ t ʏ n
legunautur	l ɛː ɣ ʏ n ø yː t ʏ r
fjarski	f j a r̥ s c ɪ
þátíð	θ a uː tʰ iː ð
aðdráttur	a ð t r a u h t ʏ r
komma	kʰ ɔ mː a
langur	l a u ŋ k ʏ r
barnamosi	p a r t n a m ɔː s ɪ
bil	p ɪː l
demba	t ɛ m p a
haraldína	h aː r a l t iː n a
kafari	kʰ aː v a r ɪ
tíðni	tʰ i ð n ɪ
tarfur	tʰ a r v ʏ r
lífga	l i v k a
klaki	kʰ l aː c ɪ
hrap	r̥ aː p
matskeið	m aː t s c e iː ð
tvíær	tʰ v iː a iː r
skemmd	s c ɛ m t
bötnun	p œ h t n ʏ n
hróðný	r̥ o u ð n iː
hálmur	h a u l m ʏ r
postullegur	pʰ ɔ s t ʏ l l ɛː ɣ ʏ r
karlkyn	kʰ a r t l̥ cʰ ɪː n
músvákur	m uː s v a uː k ʏ r
þrengja	θ r e i ɲ c a
hamingjusamur	h aː m i ɲ c ʏ s aː m ʏ r
lestarstjóri	l ɛ s t a r s t j o uː r ɪ
hvörf	kʰ v œ r v
laginn	l a iː j ɪ nː
njóli	n j o uː l ɪ
finnskur	f ɪ n s k ʏ r
marxismi	m a r̥ k s ɪ s m ɪ
grænmeti	k r a i n m ɛː t ɪ
vasahnífur	v aː s a n̥ iː v ʏ r
ljótur	l j o uː t ʏ r
endur	ɛ n t ʏ r
dæmi	t a iː m ɪ
dökkhæra	t œ h k h a iː r a
dóni	t o uː n ɪ
þorláksmessa	θ ɔ r l a u k s m ɛ sː a
fæll	f a i t l
brúsi	p r u s ɪ
fífa	f iː v a
sofa	s ɔː v a
tanta	tʰ a n̥ t a
miðasala	m ɪː ð a s aː l a
skriðnablóm	s k r ɪ ð n a p l o uː m
hvítvín	xʷ iː t v iː n
sleikur	s t l e iː k ʏ r
frysta	f r ɪ s t a
kaka	kʰ aː k a
kajak	kʰ a iː j aː k
meinbugur	m e i n p ʏː ɣ ʏ r
arnþrúður	a r t n θ r uː ð ʏ r
sumar	s ʏː m aː r
sori	s ɔː r ɪ
víóla	v iː j o uː l a
embætti	ɛ m p a i h t ɪ
stjórnborði	s t j o u r t n p ɔ r ð ɪ
brandugla	p r a n t ʏ k l a
fella	f ɛ t l a
jósebína	j o uː s ɛː p iː n a
byssustingur	p ɪ sː ʏ s t i ŋ k ʏ r
hrafndís	r̥ a p n t iː s
baldur	p a l t ʏ r
vafra	v a v r a
hausta	h ø y s t a
trúður	tʰ r uː ð ʏ r
gras	k r aː s
ljúka	l j uː k a
raul	r ø yː l
kráka	kʰ r a uː k a
almennur	a l m ɛ nː ʏ r
sveifla	s v e i p l a
stækja	s t a iː c a
einhjól	e i n ç o uː l
öreindafræði	œː r e i n t a f r a iː ð ɪ
dáð	t a uː ð
nafnorð	n a p n ɔ r ð
hlunkur	l̥ u ŋ̊ k ʏ r
skjóta	s c o uː t a
núpur	n uː p ʏ r
sætur	s a iː t ʏ r
vegasalt	v ɛː ɣ a s a l̥ t
té	tʰ j ɛː
klara	kʰ l aː r a
þræta	θ r a iː t a
steinefni	s t e iː n ɛ p n ɪ
víðfrægur	v i ð f r a iː ɣ ʏ r
vélbúnaður	v j ɛ l p uː n aː ð ʏ r
hrista	r̥ ɪ s t a
spítta	s p i h t a
eigandi	e iː ɣ a n t ɪ
vindugur	v ɪ n t ʏː ɣ ʏ r
les	l ɛː s
siglutoppur	s ɪ k l ʏ tʰ ɔ h p ʏ r
árósar	a uː r o uː s a r
gíbraltar	c iː p r a l̥ t aː r
samkennd	s a m cʰ ɛ n t
skynugur	s c ɪː n ʏː ɣ ʏ r
skurður	s k ʏ r ð ʏ r
votlendi	v ɔː t l ɛ n d ɪ
trefill	tʰ r ɛː v ɪ t l
drómedari	t r o uː m ɛː t aː r ɪ
buski	p ʏ s c ɪ
káfa	kʰ a uː v a
logri	l ɔ ɣ r ɪ
eignarfall	e i k n a r f a t l
magur	m aː ɣ ʏ r
smíð	s m iː ð
endurreisnarstefna	ɛ n t ʏ r r e i s t n a r s t ɛ p n a
langnykra	l a u ŋ k n ɪː k r a
ljá	l j a uː
rígur	r iː ɣ ʏ r
múli	m uː l ɪ
skandall	s k a n t a t l
kverk	kʰ v ɛ r̥ k
tvíburi	tʰ v iː p ʏː r ɪ
orma	ɔ r m a
geðlæknir	c ɛ ð l a i h k n ɪ r
skytta	s c ɪ h t a
fúinn	f uː ɪ nː
viðskiptavinur	v ɪ ð s k ɪ f t a v ɪː n ʏ r
staukur	s t ø yː k ʏ r
þverflauta	θ v ɛ r̥ f l ø yː t a
hraðahindrun	r̥ aː ð a h ɪ n t r ʏ n
æsa	a iː s a
sálmabók	s a u l m a p o uː k
tófugras	tʰ o uː v ʏ k r aː s
járnbraut	j a u r t n p r ø yː t
hnigna	n̥ ɪ k n a
gelta	c ɛ l̥ t a
sagnfræðingur	s a k n f r a iː ð i ŋ k ʏ r
verndari	v ɛ r n t aː r ɪ
múkki	m u h c ɪ
binda	p ɪ n t a
fjólmundur	f j o u l m ʏ n t ʏ r
tíðahvörf	tʰ iː ð a xʷ œ r v
engill	e i ɲ c ɪ t l
langamma	l a u ŋ k a mː a
guðmunda	k v ʏ ð m ʏ n t a
kókoshneta	k o uː k ɔ s n̥ ɛː t a
afburður	a v p ʏ r ð ʏ r
hvaða	xʷ aː ð a
líta	l iː t a
veiða	v e iː ð a
kæliskápur	cʰ a iː l ɪ s k aː p ʏ r
þerna	θ ɛ r t n a
lesandabréf	l ɛː s a n t a p r j ɛː v
lýsingarorð	l iː s i ŋ k aː r ɔ r ð
tætingur	tʰ a iː t i ŋ k ʏ r
franskur	f r a n s k ʏ r
rykkilín	r ɪ h c ɪ l iː n
gunndís	k ʏ nː t iː s
tvinna	t v ɪ nː a
glufa	k l ʏː v a
veiklun	v e i h k l ʏ n
peysa	pʰ e iː s a
hnútur	n̥ uː t ʏ r
fylling	f ɪ t l i ŋ k
fóðrun	f o u ð r ʏ n
kristjánssandur	kʰ r ɪ s t j a u n s s a n t ʏ r
nautahakk	n ø yː t a h a h k
bismút	p ɪ s m uː t
telpa	tʰ ɛ l̥ p a
baðmullarsvunta	p a ð m ʏ t l a r s v ʏ n̥ t a
auli	ø yː l ɪ
guðbjörg	k v ʏ ð p j œ r k
íslenskur	iː s l ɛ n s k ʏ r
þykkja	θ ɪ h c a
geisa	c e iː s a
verma	v ɛ r m a
hera	h ɛː r a
skapa	s k aː p a
sjóli	s j o uː l ɪ
ljósastör	l j o uː s a s t œː r
evrópa	ɛ v r o uː p a
sjóher	s j o uː h ɛː r
gala	k aː l a
teikn	tʰ e i h k n
atarna	a tʰ a r t n a
haki	h aː c ɪ
mjónefur	m j o uː n ɛː v ʏ r
þorlákur	θ ɔ r l a uː k ʏ r
hvarmur	xʷ a r m ʏ r
jiddíska	j ɪ tː i s k a
mykja	m ɪː c a
skel	s c ɛː l
lóðleit	l o u ð l e iː t
áhugi	a uː h ʏ j ɪ
öryggi	œː r ɪ cː ɪ
djamm	t j a mː
hálfbróðir	h a u l v p r o uː ð ɪ r
eldast	ɛ l t a s t
skadda	s k a tː a
pollagalli	pʰ ɔ t l a k a lː ɪ
misræmi	m ɪː s r a iː m ɪ
aðalbraut	aː ð a l p r ø yː t
gisting	c ɪ s t i ŋ k
hornabolti	h ɔ t n a p ɔ l̥ t ɪ
stansa	s t a n s a
tölva	tʰ œ l v a
þankastrik	θ a u ŋ̊ k a s t r ɪː k
vel	v ɛː l
gráðostur	k r a uː ð ɔ s t ʏ r
hana	h aː n a
skotvopn	s k ɔː t v ɔ h p n
óþægindi	o uː θ a iː j ɪ n t ɪ
mund	m ʏ n t
krol	kʰ r ɔː l
rymja	r ɪ m j a
gerð	c ɛ r ð
kollekta	kʰ ɔ lː ɛ x t a
þrífa	θ r iː v a
fortíðarþrá	f ɔ r̥ tʰ iː ð a r θ r a uː
aðsjáll	a ð s j a u t l
spað	s p aː ð
ormur	ɔ r m ʏ r
geislabaugur	c e i s t l a p ø yː ɣ ʏ r
oföndun	ɔː v œ n t ʏ n
botnlangi	p ɔ h t n l a u ŋ c ɪ
nestisbox	n ɛ s t ɪ s p ɔ x s
beddi	p ɛ tː ɪ
upp	ʏ h p
aðalmundur	aː ð a l m ʏ n t ʏ r
framkvæmdastjóri	f r a m kʰ v a i m t a s t j o uː r ɪ
gráðubogi	k r a uː ð ʏ p ɔː j ɪ
biðlari	p ɪ ð l aː r ɪ
ljónslappi	l j o u n s t l a h p ɪ
tré	tʰ r j ɛː
tjákn	tʰ j a u h k n
halli	h a t l ɪ
hrasa	r̥ aː s a
kefja	c ɛ v j a
markgreifi	m a r̥ k k r e iː v ɪ
brautarstöð	p r ø yː t a r s t œː ð
própan	pʰ r o uː pʰ a n
slokkna	s t l ɔ h k n a
korpönd	kʰ ɔ r̥ p œ n t
gljúfur	k l j uː v ʏ r
leigja	l e iː j a
ásmundur	a uː s m ʏ n t ʏ r
hellir	h ɛ t l ɪ r
róteind	r o uː t e i n t
breiða	p r e iː ð a
fífl	f i p l
fnykur	f n ɪː k ʏ r
mórauður	m o uː r ø yː ð ʏ r
einstaklingur	e i n s t a k l i ŋ k ʏ r
láglendi	l a u ɣ l ɛ n t ɪ
heiðdís	h e i ð t iː s
lessa	l ɛ sː a
predikari	pʰ r ɛː t ɪ k a r ɪ
fyrirgera	f ɪː r ɪ r c ɛː r a
tékki	tʰ j ɛ h c ɪ
mæna	m a iː n a
vol	v ɔː l
erfiður	ɛ r v ɪː ð ʏ r
hliðarvasi	l̥ ɪː ð a r v aː s ɪ
jóakim	j o uː a cʰ ɪ m
úr	uː r
klóelfting	kʰ l o uː ɛ l̥ʷ t i ŋ k
ólafssúra	o uː l a f s s uː r a
